Key,SourceString
Content_ID_TIPS_BASIC_00010,"Use <emoji FaceButton_Right> to talk\nto people or investigate things.\n\nA cursor will appear when you get close to something\nthat you can interact with,\nso use it as a guide to investigate various things."
Content_ID_TIPS_BASIC_00020,"If you're out adventuring and find yourself unsure of where\nto go, take a glance at the map and look for anyone marked\nwith a <emoji Fukidashi_Icon>.\nThey might have helpful hints about your next destination.\n\nYou'll find the map displayed in the bottom-left corner of\nthe screen. For a broader view, you can access a larger map\nwith <emoji FaceButton_Left>."
Content_ID_TIPS_BASIC_00030,"In fields and towns, there are locations where you can\nnavigate by climbing up and down\nusing ropes, ladders, and more.\n\nLet's explore these areas more closely."
Content_ID_TIPS_BASIC_00040,"If you come across a shimmering spot in the field,\nyou may discover an item, so let's take a closer look:\n\nUpon collecting the shimmering item, it vanishes,\nbut as you navigate the map or time elapses,\nit will reappear, allowing you to collect it once more."
Content_ID_TIPS_BASIC_00050,"By visiting the priest or sister at the church,\nyou can document your adventures in your adventure book.\n\nRecording your progress allows you to resume\nyour adventure from where you left off,\nso make sure to check in with them regularly."
Content_ID_TIPS_BASIC_00060,"Auto-save may trigger during your adventure.\n\nPlease do not turn off the power or reset the game\nwhile 'Auto Saved' is displayed at the bottom right.\n\nEven if you forget to document your progress\nand your adventure is interrupted,\nyou can still resume from the autosave."
Content_ID_TIPS_BASIC_00070,"Up to 4 people can participate in a battle.\nThese members are referred to as party members.\n\nA companion who does not participate in battle is put on\nstandby, and can be changed using 'Swap' in the battle menu.\n\nEven if a party member is on standby, they will receive the\nsame amount of experience points.\n\nAdjust the combination of party members accordingly,\ndepending on the status of allies and the monsters you face."
Content_ID_TIPS_BASIC_00080,"You can adjust the camera direction using <emoji RightStick>.\nTo align the camera with the\ndirection your character is facing,\nsimply press the <emoji RightStickButton> button."
Content_ID_TIPS_BASIC_00090,"By pressing <emoji LeftShoulder> in the field or a town,\nyou can continuously run in the direction you're facing.\n\nWhile running, you can adjust your direction using <emoji LeftStick>\nand jump using <emoji FaceButton_Bottom>."
Content_ID_TIPS_BASIC_00100,"To ride the dolboard in the field, simply press <emoji LeftTrigger>.\nIt allows you to travel much faster than walking,\nmaking it ideal for covering long distances.\n\nTo dismount the dolboard, press <emoji LeftTrigger> while riding it."
Content_ID_TIPS_BASIC_00110,"Press <emoji RightTrigger> in a field or town to open the quick menu.\nYou can access important items and commands from there."
Content_ID_TIPS_BASIC_00120,"In 'System Settings' you can\nadjust various in-game configurations.\n\nWhether you need to modify initial settings,\nauto-save preferences, and more."
Content_ID_TIPS_BASIC_00130,"As you embark on an adventure, friends may join you.\nThere are friends who join you temporarily\nand others who will fight alongside you forever after.\n\nTemporary party members cannot be recruited,\nwill not grow, and cannot change equipment\nor acquire new skills.\n\nThe party members who remain with you permanently\nwill gain experience points and\nlevel up by winning battles,\njust like the main character.\nAs their level increases, they will gain skill points,\nso set up their skill panels and help them grow.\n\nYou can also change your allies' weapons and armor.\nUnlike the main character, their appearance\nwill not change according to their armor, but\nweapons and armor will still be effective, so\ndon't forget to equip your allies.\n\nIf you find stylish equipment for your party members,\nyou can change their appearance from the equip screen.\nPlease keep an eye out for it."
Content_ID_TIPS_BATTLE_00010,"You and your party members will act according to\nthe 'Tactics' set for each.\n\nIf you select 'Tactics' from the 'Misc' menu,\nyou can change the 'Tactics' of your friends or yourself.\n\n'Tactics' can also be changed during battle.\nIf you press <emoji FaceButton_Top> during battle, the\n'Tactics' menu will open during your turn and\nyou can make changes."
Content_ID_TIPS_BATTLE_00020,"If you select 'Follow orders' in 'Tactics',\nyou can concretely decide actions during battle, such as\nspells, special skills, attack targets, etc.\n\nIf you want someone to act by themselves,\ntry selecting 'Fight Wisely'."
Content_ID_TIPS_BATTLE_00030,"By raising your level or unlocking skill panels,\nyou can learn special moves called 'Coup De Graces'.\n\nWhen tension reaches a certain amount in battle,\na new option called 'Specials' will appear\nin the command menu.\n\nIf you select it, you can choose from\nthe Coup De Graces you currently know and use them.\n\nEach uses a different amount of tension.\nWhen used, your tension will drop by that amount."
Content_ID_TIPS_BATTLE_00031,"A special move that only the hero princess Anlucia can use.\n\nEliminates one opponent's advantageous effects, including\nCurses. Inflicts damage and immobilizes the opponent.\n\nBecause it is so powerful, Anlucia will become tired and\nunable to move, so you need to be careful when using it.\n\nAlso, Anlucia may become excited as she fights against\nthe power of darkness."
Content_ID_TIPS_BATTLE_00032,"A special move that only the hero princess Anlucia can use.\n\nIt can discern illusions and also lower\nthe opponent's elemental resistance.\n\nIt can eliminate enemy clones.\n\nIf you lose sight of the enemy's main body, try using it."
Content_ID_TIPS_BATTLE_00033,"A special move that only the hero princess Anlucia can use.\n\nIt grants all allies a brief period of\nprotection from any attack once.\n\nWhen you sense that the opponent is about to use a powerful technique, don't hesitate to use it."
Content_ID_TIPS_BATTLE_00034,"A special move that only the hero princess Anlucia can use.\n\nIt grants courage to all allies and\nrepels negative effects.\nIt can help weak allies who cannot withstand damage\nto stand strong with this technique.\n\nSince it also affects allies in reserve,\nlet's strategically utilize substitutions in battle."
Content_ID_TIPS_BATTLE_00040,"Under the fortune teller vocation,\nyou can use Monster Tarot during battle.\n\nWhen the battle starts, four monster tarot cards are\ndealt from the equipped deck.\nYou can use one piece by selecting the 'Tarot' command.\n\nThe effect when used varies greatly depending on the zn'Arcana', 'Monster', and 'Rank' on the Monster Tarot.\n\nThe deck is randomly shuffled each time you enter a battle.\nThe order in which the Monster Tarot appears\nchanges each time."
Content_ID_TIPS_BATTLE_00050,"Battle members can be replaced with\nstandby allies during battle using 'Swap'.\n\nHowever, the replaced member cannot act during their turn.\nConsider the timing of party member swapping carefully.\n\nWhen all battle members are activated,\nstandby allies will appear and join the battle."
Content_ID_TIPS_BATTLE_00060,"If you select 'Equip', you can\nswap what you have equipped with\nwhat is in your item bag even during battle."
Content_ID_TIPS_BATTLE_00070,"You can resume the adventure from\nany of the following points:\n-'Last place you saved'\n-'Last place you visited'\n-'From autosave'\n\nWhen you return to the last place you prayed or\nthe last place you visited, the experience points and\nitems you obtained will remain the same,\nbut the money you have will be halved.\n\nUpon returning to the auto-saved location,\nyour EXP and money will be returned to their original state.\n\nThe money you deposit in the Gold Bank\nwill not decrease in any case,\nso it's recommended that you bank as much as possible."
Content_ID_TIPS_BATTLE_00080,"When you feel like running away during a battle,\nuse <emoji FaceButton_Top> to open the menu and select 'Flee'.\nThere is a probability that you can run away.\n\nIf you fail, the character who chose 'Flee'\nwill be unable to act for that turn."
Content_ID_TIPS_BATTLE_00090,"You can change battle speed during battle\nfrom 'Settings' in 'Misc'.\n\nThis is recommended for\nthose who want to advance battles quickly.\n\nThis setting does not provide\nany advantage or disadvantage in battle."
Content_ID_TIPS_BATTLE_00100,"'HP'\nAbbreviation for hit points.\nIt decreases each time you receive damage.\nWhen it reaches zero, you will faint.\n\n'MP'\nAbbreviation for magic power.\nConsumed when using spells or abilities.\nIf you don't have enough MP,\nyou can't use a spell or an ability.\n\n'Max HP'\nMaximum value of HP.\n\n'Max MP'\nMaximum value of MP.\n\n'Attack'\nIf you have high Attack Power,\nthe damage dealt by physical attacks\nsuch as weapon attacks will increase.\n\n'Defense'\nIf your Defense is high,\ndamage received from physical attacks will be reduced.\n\n'Magical Might'\nThe higher the Magical Might is,\nthe more powerful your attack spells become.\n\n'Magical Mending'\nThe higher the Magical Mending is,\nthe more HP recovery spells will recover.\nIt also increases the probability that\na resurrection spell will be successful.\n\n'Strength'\nThe basic strength value\nexcluding effects such as equipment and skills.\n\n'Resilience'\nThe basic defense power value\nexcluding effects such as equipment and skills.\n\n'Agility'\nIf agility is high, you will have a higher chance of\nbeing able to attack first during battle.\nAlso increases your dodge rate of enemy attacks.\n\n'Deftness'\nIf deftness is high, you will have a higher chance of\nlaunching a first strike at the start of battle.\n\n'Charm'\nIf Charm is high, you have a better chance of\nenemies being infatuated by you during battle.\nEnemies who are charmed cannot act on the next turn."
Content_ID_TIPS_BATTLE_00110,"'Sleep'\nWhen you physically attack a sleeping enemy,\nthey often wake up, but\nthey are less likely to wake up when\nspells and non-physical attacks are used.\n\n'Dazzle'\nWhen affected by dazzle, normal attacks are\nmore likely to fail, but spells and\nother attacks are unaffected.\n\n'Charm'\nAllies affected by confusion or charm\nmay attack party members.\nIt's dangerous not to recover quickly.\n\n'Poison'\nWhen poisoned, you take damage each turn in battle.\nThe effect continues after battle,\nwith damage occurring every few seconds.\nIt will eventually heal, but it's recommended to\nrecover with items or spells.\n\n'Curse'\nWhen cursed, you may be unable to\nact on your turn during battle.\nSome items or special skills can remove it,\nbut when there's no other option,\ngo to a church to have it lifted."
Content_ID_TIPS_BATTLE_00120,"When you receive damage during battle or use tools,\nyour 'Tension' will increase, and\nthe tension gauge displayed to the\nleft side of your face icon will rise.\n\nIf you learn Coup De Graces, you can use\nthe accumulated tension to execute powerful special moves.\n\nThe amount of tension consumed differs depending on\nthe Coup De Grace, so use it wisely.\n\nAlso, when your tension reaches its maximum,\nyou enter a state of Super High Tension, where\nthe damage of all attacks and the amount of recovery\nwhen using skills and spells increase.\n\nSome special moves can be used as much as you like.\nThe Super High Tension state will be cancelled when you\nuse a special move that consumes 100% of the tension,\nor after a certain number of turns have passed.\n\nAt which point, Super High Tension will be released,\nand the tension will return to 0.\n\nHowever, if the battle ends while you are in\na state of Super High Tension, the state will\ncontinue into the next battle, so don't panic.\n\nYour tension will increase at various other times,\nso use it wisely to gain an advantage in battle.\n\nNote: The Super High Tension state is\nsometimes abbreviated as SHT in explanatory texts."
Content_ID_TIPS_CRAFTSMAN_00010,"With the forge, you can create equipment\nusing recipes and materials, or repair and\nenhance existing gear.\n\nThere are some equipment pieces\nthat can only be acquired by forging.\n\nRecipes can be found in bookshelves and shops,\nwhile materials are gathered from various points.\nIf you spot shimmering spots or bookshelves, investigate.\nYou can also buy some recipe ingredients from shops."
Content_ID_TIPS_CRAFTSMAN_00020,"The fundamental process of forging\ninvolves shaping the raw material of the equipment\nby heating the material, bashing\nand plunging it into cold water.\n\nAs you bash, the blue gauge will fill up, so\ntry to stop it within the green 'success zone'.\n\nMoreover, stopping at the marker within the center\nof the success zone will turn the gauge yellow\nand illuminate the marker, potentially yielding\nsuperior results."
Content_ID_TIPS_CRAFTSMAN_00024,"When you use 'Bash' or 'Skills',\nyour 'concentration' will decrease, and\nwhen you deplete your concentration, you will\nno longer be able to continue forging.\n\nBe careful of your remaining concentration\nwhen choosing the command.\n\nAs your forging level increases,\nyour forging skills will also improve:\nthe number of forging skills you can use and\nyour concentration points will increase."
Content_ID_TIPS_CRAFTSMAN_00026,"Even when using the same technique,\nthe higher the 'temperature' of the material,\nthe greater the power of each strike.\n\nWhen you strike the material, its temperature drops, and\nwhen it gets cold, strikes will no longer be effective.\n\nIt seems that some 'skills' can adjust\nthe temperature of the material or\nhit multiple times at once.\n\nUse them well and aim for 'perfection'."
Content_ID_TIPS_CRAFTSMAN_00030,"If you choose to 'Rework an Item',\nyou can challenge yourself to improve the quality\nof your equipment.\n\nThis will consume 'Perfectionist Pearls'.\n\nEven if you fail, your equipment will not break;\nIf you succeed, the resulting equipment will be\nsuperior to the original."
Content_ID_TIPS_CRAFTSMAN_00040,"Occasionally, while forging,\na 'Master Stroke' will be triggered,\nallowing the forge's special technique,\n'Flame of Hephaestus' to be used.\nHowever, it can only be used once per forging session.\nAfter use, if you forge the material with\n'Bash' or 'Skills', it will become a 'Critical hit',\ngreatly increasing the power of the strike.\n\nEven if the power exceeds the success zone,\nthe gauge will always stop at the center of the success zone.\n\nBe cautious as the effect will end\neven if the next action after using the\nspecial move does not strengthen the material,\nsuch as raising the temperature."
Content_ID_TIPS_CRAFTSMAN_00050,"From the 'Item' menu, selecting 'Alchemy pot'\nallows you to alchemize new consumables\nusing multiple items as ingredients.\n\nWhen you select the item you want to create from the\n'What do you want to make?' menu and have the\n'Required materials', alchemy begins immediately,\nand you receive the new item.\n\nIf you lack the 'Required materials', they will be displayed\nin gray and cannot be selected.\n\nRecipes that expand these options can be obtained from\nsources such as bookshelves and\nrecipe books sold in shops.\n\nMaterials can be obtained from gathering points\n or purchased at shops."
Content_ID_TIPS_FACILITY_00010,"The Traveler's Bazaar sometimes has\nspecial items for sale that are not sold at other stores.\n\nThe products will change from time to time, so\nplease check out the Traveler's Bazaar frequently!"
Content_ID_TIPS_FACILITY_00020,"When you talk to an Alltrades Abbey priest in a tavern\nor similar place, you can undergo a 'job change'\nto change your class.\n\nWhen you change jobs, your level will reset to\nthe corresponding level of that vocation, but\nthe levels you've gained and the\nskills you've acquired so far are recorded.\n\nSo when you change back to your original vocation,\nyou can resume from that level.\n\nFurthermore, job-specific skills cannot be used in\nother vocations, but skills like 'purification' learned\nby raising the level of a Martial artist can be used\nin any vocation once learned.\n\nAdditionally, some status enhancement effects such as:\n'strength +10' learned by raising a warrior's level,\nor 'MP +20' learned by priests or mages\nare inherited in other occupations,\nso experience various classes and become stronger!"
Content_ID_TIPS_FACILITY_00030,"You can keep scouted companion monsters\nat the monster tavern.\n\nAdditionally, you can swap the current companion monster\nwith another that you have entrusted in their care."
Content_ID_TIPS_FACILITY_00040,"At the 'Adventurer's Tavern', you can sign up and\nsend a 'friend's gift', or redeem a\n'friend's gift' you've received from another.\n\nYou can even have your own tab registered.\n\nUpon registration, you can\nattach a single request form of your choice.\n\nLikewise, if the 'Friend's Gift' you've received\nhas a request form attached,\nyou can fulfil it yourself."
Content_ID_TIPS_FACILITY_00050,"At the 'Accessory Synthesizer' found in Verinard Castle Town,\nyou can merge the effects of similar accessories,\nconsolidating them into a single accessory.\n\nWhile a single accessory can hold a maximum of 3 effects,\nthere are extra effects available for accessories\naside from the 'composite effect'.\n\nOnce accessories are merged,\nthey cannot be separated, so\nconsider your choices carefully before synthesis."
Content_ID_TIPS_FACILITY_00060,"Talking to Dorothy in the north of Rendoor\nand handing over the labyrinth coins you have\nallows you to enter the 'Magic Labyrinth'\nwhere you can battle various bosses.\n\nYou can find out which monsters appear\nby the name of the labyrinth coin or by\nchecking 'Details'.\n\nThere are monsters that can only be fought\nin the 'Magic Labyrinth' and items\nthat can only be obtained here,\nso keep challenging yourself.\n\nRest assured that labyrinth coins\nwill not be lost even if you lose\nin battles in the 'Magic Labyrinth'.\n\nYou can obtain labyrinth coins through draws\nor create them up to the trading post\nif you have recipes and materials."
Content_ID_TIPS_FACILITY_00065,"There are a total of six mausoleums\nhidden within the pyramids\nscattered across the continent of Lendersia.\n\nUpon inspecting the coffin inside each mausoleum,\nthe guardians of the treasure will emerge,\ninitiating their battle.\n\nOnce the battle commences,\nyou must either vanquish all the treasure guardians,\nface a party wipeout, or\nopt to 'give up' during the encounter.\nExiting the mausoleum is not an option.\n\nDefeating all the treasure guardians grants you access to\nexclusive accessories and materials found only within.\nStrive to conquer all the mausoleums."
Content_ID_TIPS_FACILITY_00070,"Talking to Dorothy in the north of Rendoor,\nyou can hand over the labyrinth coins you possess\nand gain access to the 'Magic Labyrinth',\nwhere you can battle various bosses.\n\nYou can find out which monsters appear\nby checking the name of the labyrinth coin or by\nexamining them in detail.\n\nSince there are monsters that can only be battled\nin the 'Magic Labyrinth' and items that are exclusive\nto this place,\nfeel free to challenge it repeatedly.\n\nRest assured that labyrinth coins\nwon't be lost even if you're defeated\nin battles within the 'Magic Labyrinth'.\n\nYou can obtain labyrinth coins through draws\nor craft them up to the trading post\nif you have recipes and materials."
Content_ID_TIPS_FACILITY_00080,"'Monster Battle Road' is a competition where\na party composed solely of companion monsters engages\nopposing teams within the 'Monster Fighting Arena'.\n\nYou can join 'Monster Battle Road' at the reception counter\nof the 'Monster Battle Arena' provided you\nhave four companion monsters.\n\nTo acquire companion monsters,\nyou need to switch jobs to either 'Magic Hand' or\n'Double Hand' and scout the monster you wish to befriend.\n\nVictory in 'Monster Battle Road' awards you\nBattle Road Points and Battle Road Coins, enabling you to\nparticipate in rank-up exams.\n\nYou can further boost the capabilities of your\ncompanion monsters by equipping them with badges.\n\nBadges are obtainable through\nthe exchange of Battle Road Coins."
Content_ID_TIPS_FACILITY_00090,"At the 'Beauty Salon', you can\nalter your character's appearance and indulge in fashion.\n\nYou can modify the color of your hair or skin,\nincluding options which were unavailable initially."
Content_ID_TIPS_FACILITY_00110,"If you obtain a 'Dolboard Prism' from somewhere, visit\n'Custom Shop Decory' in Mount Gatara and ask them to\ninstall it for you.\n\nOnce the 'prism' is affixed to the dolboard,\nyou can alter your dolboard's appearance\nwhenever you like by consulting 'Custom Shop Decory'."
Content_ID_TIPS_FACILITY_00120,"If you obtain a 'Lottery Ticket' from somewhere,\nspeak to the Travel Concierge at an inn in a major town.\n\nYou can participate in the 'Lottery' once for each Ticket.\nIf you possess 10 or more tickets,\nyou can participate 10 consecutive times,\nconducting 10 tries in one go.\n\nThe types and probabilities of prizes you can\nwin with the 'Lottery' are consistent worldwide.\n\nMoreover, you can acquire 'Lottery Tickets'\nas complimentary items while shopping at stores,\nas rewards from subjugation missions,\nand through various other means."
Content_ID_TIPS_FACILITY_00130,"If you possess the Heaven and Mine Striker class,\nyou have the ability to summon\n'Spirits' during battles.\nThe summoned 'Spirit' will position itself behind the main\ncharacter and will act automatically when its turn arrives.\n\nThere are four types of 'Spirits' that can be summoned,\neach with unique characteristics, skills, and spells.\n\nKakaron:\nPrimarily focused on recovery, with defensive\nstrengthening spells also in its arsenal.\n\nKushalami:\nSpecializes in recovery, with attack-based\nstrengthening abilities also at its disposal.\n\nBarbaroo:\nWhile mainly geared towards physical attacks,\nit also possesses special skills that reduce both attack and defense.\n\nDomedi:\nLargely relies on spell attacks and can\nutilize a variety of spells."
Content_ID_TIPS_FACILITY_00140,"By speaking with the 'subjugation team' in town, you can\ndispatch the friends you've enlisted at the tavern\nas your monster subjugation team to fulfill your request."
Content_ID_TIPS_FACILITY_00150,"It seems that Battle Phantasm is scheduled to take place at\nthe Colosseum on the entertainment island of Rakkaran.\n\nThere are prerequisites for joining Battle Phantasm.\nYou can enter if you successfully complete all village,\ntown, and story-related vocation quests.\n\nOnce you meet the requirements to participate,\napproach the receptionist at the Colosseum.\n\nFulfill quests and enhance your abilities.\nStrive to claim prestigious rewards."
Content_ID_TIPS_FIELD_00010,"There are stone monuments called\n'stone monuments of arrival' scattered throughout the world.\nBy inspecting these, you can\nregister a new destination in the Zoomstone.\n\nStone monuments that have been registered will shine, so\nplease be sure to visit all of them."
Content_ID_TIPS_FIELD_00020,"'Bravestone Pillars' are pentagonal stone pillars with wings\nthat are scattered throughout Lendersia.\n\nBy holding the Brave Stone and examining the stone pillar,\nyou can freely move between the True and False Lendersias."
Content_ID_TIPS_FIELD_00030,"By using the 'Zoomstone', you can\ninstantly travel to registered towns and fields.\n\nUpon entering a town,\nit will be automatically registered in the Zoomstone.\n\nHowever, you must personally inspect stone monuments to\nregister locations in the overworld, so don't forget."
Content_ID_TIPS_FIELD_00031,"If you have a Zoom booster, you can\npass through overhead obstacles such as the ceiling and move with ease.\nIf not, you have to exit town buildings or dungeons like\ncaves on foot or with the Zoom spell.\nNow, your adventure will be more comfortable.\nPlease select Zoomstone from the tool commands.\n\nHowever, be cautious, as mysterious forces may\nnullify the stone's effects in certain areas."
Content_ID_TIPS_FIELD_00040,"At times, in the field or a town, you may encounter\na 'ferryman' offering passage on a boat.\n\nUpon speaking to them, they'll transport you to\nanother location or area free of charge.\n\nAnother ferry will also be present at\nyour destination, ensuring you'll have a way back."
Content_ID_TIPS_FIELD_00050,"If you possess the 'Intercontinental Rail Pass' key item,\nyou can journey to another continent via\nthe Intercontinental Railroad found at\ntrain stations in major towns.\n\nSpeak to the 'station staff' within the station and\nselect your desired destination.\nBy paying a fee, they will facilitate your journey.\n\nHowever, certain stations may have conditions for use,\nso if unavailable, advance the storyline accordingly."
Content_ID_TIPS_FIELD_00060,"If you have the 'Titus boarding pass' key item,\nyou can ride the Grand Titus-\nPay the fee, and it will take you to your destination.\n\nInside the Grand Titus, you can engage\nin various activities such as fishing and shopping.\n\nYou will be at your destination in no time."
