Key,SourceString
Content_ID_TIPS_FIELD_00070,"If you use the 'Dragon Flute' key item,\na flying dragon will appear in response to the sound-\nyou can ride it and travel above Lendersia.\n\n<emoji LeftStick> - Proceed\n<emoji RightStickRotate_Up><emoji RightStickRotate_Down> - Change altitude\n<emoji RightStickRotate_Left><emoji RightStickRotate_Right> - Camera rotation\n<emoji LeftShoulder> - Autorun\n<emoji RightShoulder> - Dash\n<emoji FaceButton_Right> - Landing\n\nThere are restrictions on where the flying dragon can land.\nA mark will be displayed where landing is possible.\nWhen you see the landmark where you want to get off,\npress <emoji FaceButton_Right>."
Content_ID_TIPS_FIELD_00080,"Omit"
Content_ID_TIPS_FIELD_00090,"Depending on the time of day, it may get dark and\nthe weather may change.\n\nIt also seems that some monsters\nappear depending on the time of day and weather.\n\nAt the inn, you can rest until night or\nstay until morning."
Content_ID_TIPS_FIELD_00100,"You may be able to obtain items by\nexamining pots and chests placed in towns and buildings.\n\nYou can check the treasures you have obtained in the\n'List of acquired treasures' in the 'Records' menu."
Content_ID_TIPS_MENU_00010,"If you select 'Heal All' on the menu screen,\nit will use MP to fully restore everyone's HP.\n\nIf you know a spell that can cure status ailments,\nyou can revive your allies while under attack, and\nyou can also recover from conditions like poison.\n\nAdditionally, if you choose 'Handy Heal All' from 'Misc',\nHP will be restored efficiently, helping you conserve MP.\n\nUtilize these options to manage your MP effectively, but\nif you run out of MP midway,\nyou'll only be able to heal up to that point.\n\nWhile the menu screen is open, press the <emoji FaceButton_Left> button\nto trigger 'Heal All' as well."
Content_ID_TIPS_MENU_00020,"While adventuring, you'll come across various items.\n\nItems fall into different categories:\n\n'consumables', which grant effects when used;\n\n'equipment', providing benefits when worn;\n\n'materials', used for crafting tools and equipment.\n\nItems crucial to your adventure are called 'key items'.\nThese cannot be discarded or sold.\n\nAdditionally, certain items are\nautomatically stored in your 'Item Bag'."
Content_ID_TIPS_MENU_00030,"If you choose 'Items' on the menu screen, you can view\nthe details of the items you possess and utilize them.\n\nItems with effects can be activated by selecting the\nitem in this menu and confirming with 'Use'.\n\nIf your inventory is full, you can select the\nitem from this menu and select 'Discard' to remove it.\n\nThere's a cap on the number of items storable in\nyour 'Consumables', yet through your adventures,\nyou may enhance your carrying capacity."
Content_ID_TIPS_MENU_00040,"Some items that are used\nat special facilities or for exchange\nwill automatically be placed in the 'Item Bag'.\n\nFrom this menu, you can check the quantity of\nitems collected and view their details."
Content_ID_TIPS_MENU_00050,"Simply possessing equipment won't yield any benefits,\nso ensure proper equipment usage through the menu.\n\nIn the 'Equipment' section, you can\nequip or unequip items stored in your 'Item Bag'\nor those worn by your companions.\nCertain equipment may have usage restrictions.\n\nFurthermore, there's a capacity limit for\nitems stored in your 'Item Bag,' yet\nyou might expand your carrying capacity as\nyour adventure progresses."
Content_ID_TIPS_MENU_00060,"In the 'Equip Now' option of the 'Equipment' menu,\nyou can quickly equip yourself with weapons and armor.\n\nNavigate to 'Equip Now' and use <emoji DPad_RightLeft> or <emoji LeftStickRotate_Left><emoji LeftStickRotate_Right>\nto optimize for 'Attack', 'Defense', or 'Magic'.\n\nThe displayed equipment options for all equipment slots\nexcept accessories will be highlighted in light blue.\n\nPress <emoji FaceButton_Right> to immediately equip the selected item.\nItems already equipped by allies\nwon't be available for selection."
Content_ID_TIPS_MENU_00070,"If you're a fortune teller, you can\nalter your equipped deck or inspect the decks you possess\nthrough 'Monster Tarot' in the 'Equipment' menu.\n\nEach deck contains different contents, so please\nadjust your equipment accordingly to the situation."
Content_ID_TIPS_MENU_00080,"Press the <emoji FaceButton_Top> button\nin the 'Equip' menu to open 'Glamour'.\n\nGlamour is a function that allows you to register your\nfavorite combination of equipment as a single outfit.\n\nIf you wear the registered Glamour,\nyou can change your appearance to the\nequipment set without changing your current strength.\n\nEven if the equipment used in Glamour disappears,\nthe appearance registered in Glamour can be used as is."
Content_ID_TIPS_MENU_00090,"With the map open on <emoji FaceButton_Left>,\npress <emoji FaceButton_Right> to open the 'Map Menu'.\n\nThis handy menu offers various conveniences, including:\n\n- Navigational guidance for your next destination\n- Scoping the map around your current location\n- Tracking the whereabouts of your character."
Content_ID_TIPS_MENU_00100,"The main character can pursue a variety of vocations\nother than the one initially chosen.\n\nSwitching your vocation is referred to as 'Job Change'.\nYou can change your job by speaking with\nthe Alltrades Abbey priest at a bar in town.\n\nEach vocation comes with its unique traits,\nincluding stats and special skills that can be acquired.\n\nAs you progress in different jobs,\nadditional vocations may become available."
Content_ID_TIPS_MENU_00110,"As you gain battle experience and level up,\nyou may acquire skill points.\n\nBy utilizing these skill points, you can\nacquire a range of abilities and spells to\nstrengthen both yourself and your allies.\n\nTo learn a new skill,\nallocate points on the 'Skill Panel' in 'Misc'."
Content_ID_TIPS_MENU_00120,"In the 'Skill Panel' menu, you can\nallocate acquired skill points to\nlearn new abilities and spells.\n\nAlso, when you learn them,\nadjacent panels will unlock and\nthe number of skills you can learn will increase.\n\nYou can also reset your skills at any time."
Content_ID_TIPS_MENU_00130,"You can use 'Skill Reset' in the 'Skill Panel' to reset\nthe skill points you have allocated.\n\nSkill points will return when resetting skills.\nEach point costs 20 gold.\n\nAdditionally, you can reset your skills at any time."
Content_ID_TIPS_MENU_00140,"Omit"
Content_ID_TIPS_MENU_00150,"If you select 'Records' from the menu, you can\nview a record of your adventures,\nincluding the items you've obtained\nand the monsters you've defeated,\nas well as the treasure chests you've opened so far."
Content_ID_TIPS_MENU_00160,"As you advance through your adventure, you may\nencounter opportunities known as 'quests.'\n\nThese quests come in various forms, and upon completion,\nyou'll receive rewards, and even additional benefits.\n\nLook for a purple <emoji Question_Icon> above characters who offer quests,\nthen speak to them to accept the task.\n\nTo view quests available for acceptance or completed ones,\nconsult the 'Quest List' within the 'Records' menu."
Content_ID_TIPS_MINIGAME_00010,"To partake in casino games, you'll need 'casino coins'.\nThese can be acquired from the coin shop\nat a rate of 20 gold per coin.\n\nInside the main area of the casino,\nthe northern section accommodates games played with 1 coin,\nwhile the southern section hosts games played with 10 coins.\n\nTowards the rear, there's an exclusive VIP room\nwhere the stakes are set at 100 coins per game.\nUntil you're accustomed,\nit's advisable to start with lower-stake areas.\n\nThe 'casino coins' you earn can be swapped for\nprizes at the prize exchange office,\nincluding exclusive, luxury rewards unique to the casino."
Content_ID_TIPS_MINIGAME_00015,"Select an available poker table and choose\n'Yes' to start playing poker.\nSwap the dealt five cards to form winning hands!\nSet the coin denomination, then hit Start.\nAfter the cards are dealt, decide which cards to 'Keep' and\nwhich to 'Exchange,' then select 'Deal' to swap cards once.\nWhen you achieve a winning hand,\nyou can challenge the 'Double Up.'"
Content_ID_TIPS_MINIGAME_00020,"When you form a winning hand in poker,\nyou can challenge the Double Up.\nTry to guess a card stronger than\nthe one on the left from among four cards.\nIf you win the Double Up, the coins you receive will double,\nbut if you lose, you'll lose the coins gained in this game.\nLet's aim to become a poker master\nwhile discerning the right moment to stop!"
Content_ID_TIPS_MINIGAME_00030,"When challenging the Double Up, occasionally\na 'treasure chest' with several locks may appear.\nIf you win the Double Up once,\nyou can break one lock.\nWhen you break all the locks,\nthe treasure chest will open, and\nyou can receive the treasure.\nEven if you fail, the treasure chest will remain\nas you continue playing poker,\nso let's boldly challenge until\nall the locks are broken!"
Content_ID_TIPS_MINIGAME_00040,"Select an available seat at a roulette table and\nchoose 'Yes' to play roulette.\nThe value of the chips you bet varies\ndepending on the table you choose.\nPredict the number where the ball will land and\nplace your chips accordingly.\n\nYou can bet chips on multiple locations, and\nthe payout varies depending on where you bet.\nIf your prediction is correct, you'll earn coins.\n\nUse your intuition and aim to be a Roulette Master!"
Content_ID_TIPS_MINIGAME_00050,"Jackpot is a special 'big win'.\nWhen five '7's line up during a Metal Change in slots,\nit becomes a jackpot, and\nyou receive a large amount of coins.\nThe probability is low, but\naim for a fortune in the jackpot"
Content_ID_TIPS_MINIGAME_00060,"Select an available slot machine and\nchoose 'Yes' to start playing slots.\nAdjust the number of coins to use with <emoji DPad_Up> and <emoji DPad_Down>, then press Start.\nAlternatively, press <emoji DPad_Left> to set the maximum bet currently available, and\npress <emoji FaceButton_Right> to start the slot machine.\nIf you line up the same symbols\non the lines where you bet coins,\nthree or more in a row, it's a big win!\nYou'll receive coins\nbased on the type and number of symbols lined up."
Content_ID_TIPS_MINIGAME_00070,"If there are 3 or more treasure chests\n on the line you bet the coin on,\na treasure box chance will occur.\n\n In Treasure Chest Chance,\n A treasure chest will be opened on the spot, and\nyou will get a lot of coins.\n You will be able to select and open\na box by yourself from 9 treasure chests.\n When a game or raid monster appears,\nit develops into a casino raid."
Content_ID_TIPS_MINIGAME_00080,"When three or more Stray Metals line up consecutively\non the line where you placed your bet,\nit's a chance to win a large amount of coins!\nDuring Metal Chance, it becomes easier to\nmatch the patterns, and the coins earned when\npatterns match are doubled!\nAdditionally, if five 7s line up during Metal Chance,\nit's a jackpot big win!\nSeize the opportunity and aim to be a Slot Master!"
Content_ID_TIPS_MINIGAME_00085,"Select an available bingo table and choose\n'Yes' to play bingo.\nIn the main room's northern area,\n you can play for 250 coins,\nwhile in the southern area, it's 500 coins.\nIn the VIP-exclusive room, you can play for 1000 coins.\nAchieve bingo when the numbers where the balls drop align in\na line vertically, horizontally, or\ndiagonally for five squares!\nDepending on the number of completed bingo lines,\nyou'll receive rewards.\nFor the first three balls, you can manipulate the panels,\nso rotate the numbers on the panels with <emoji FaceButton_Right>\nwithin the time limit! Rearrange them to make bingo easier.\nBonus additions when you open a treasure chest or defeat\na Stray Metal! Use your intuition and\naim for an All Bingo!"
Content_ID_TIPS_MINIGAME_00090,"In each game at the casino, opening a treasure chest may\ncause a Raid Monster to appear,\ntriggering a Casino Raid.\nWhen a Casino Raid occurs, cooperate with the characters at\nthe same table to defeat the monsters within the time limit.\nDuring the Casino Raid, you can play without losing coins, and\nmatching combinations or making\naccurate predictions can damage the monsters.\nIf you manage to defeat the monsters within the time limit,\nyou'll receive coins as raid rewards\nbased on the defeated monster.\nCassino Raids can also be triggered\nby characters other than yourself,\nso sticking to the same game increases your chances!"
Content_ID_TIPS_OTHER_00010,"There are individuals in this world who\ncollect small medals.\n\nIf you gather them, you can exchange them for prizes, so\nif you collect some, take them with you."
Content_ID_TIPS_OTHER_00020,"What is 'Draconian Quest'?\n\nIt's a setting where you can embark on the adventure with\nvarious restrictions, such as:\n'You cannot equip armor',\nor 'Harder enemies'.\n\nYou can establish these conditions when\ncreating an adventure book or when new content is added.\n\nYou can also activate multiple\nDraconian Quests simultaneously, but\nyou'll need to clear them one by one as they become\ncommon across all adventure books.\n\nAdditionally, if you wish to abandon your quest midway,\nyou can do so at the church.\n\nEven upon quitting, you can resume your\njourney without any restrictions, though\nyou won't be able to reapply Draconian Quest restrictions.\n\nFeeling bold?\nConsider experimenting with different Draconian Quests!"
Content_ID_TIPS_OTHER_00030,"You can give up at anytime using the church's\n'Draconian Quest Cancellation' option.\n\nOnce cancelled, you can proceed with\nyour adventure unrestricted, but\nyou won't be able to set it again."
Content_ID_TIPS_OTHER_00035,"After some playtime,\nnew options for 'System Settings' and\n'Draconian Quest Settings' will be unlocked.\n\nThe 'Draconian Quest Display' setting\nallows Draconian Quests to be showcased on the\nscreen while in-game.\n\nConsider utilizing this\nwhen sharing your gameplay with friends."
Content_ID_TIPS_OTHER_00040,"Once you've vanquished the story's boss monster and\nwitnessed the ending, you'll gain the ability to\nlearn the 'Spell of Restoration' at the church.\n\nBy incorporating this 'Spell of Restoration' into your\nDragon Quest experience, you can\nunlock new games and features.\n\nCurious to explore the alternate realm of Dragon Quest X?"
Content_ID_TIPS_OTHER_00050,"Upon activating Double Bubble, you'll enter\n'Double Time' for 30 minutes.\n\nDuring 'Double Time', experience points and gold\nearned in battles are doubled for the entire party.\n\nThis bonus can be stacked with other items that\nboost experience points, such as meals and Angel Slime Hats.\n\nHowever, using two Double Bubbles within the time limit\nwon't yield additional benefits.\n\nTherefore, it's crucial to consider usage,\nas subsequent activations within the duration will\nmerely overwrite the current timer."
Content_ID_TIPS_OTHER_00060,"Bonus items obtained from {Store} can be claimed via\n'Receive a Present' in the Adventure Book menu.\n\nYou have the opportunity to\nreceive bonus items across all adventure books. However,\nyou won't receive duplicates of items already claimed in\nprevious adventure books. Please keep this in mind.\n\nYou'll receive bonus items in Adventure Book 1.\nAs you progress and save in Adventure Book 2,\nyou'll receive items specific to Adventure Book 2.\n\nSince the records are retained,\nyou won't be able to claim the same bonus item again.\n\nAlternatively, you can receive bonus items in the\nadventure book of another character who's started anew."
Content_ID_TIPS_OTHER_00070,"Some DLCs offer bonus items, while\nothers introduce additional stories.\n\nYou can integrate them into\nDragon Quest X Offline by\nproviding the required details\nat {Store} and downloading them.\n\nKeep in mind that story-enhancing DLCs\nconsume significant storage space, so\nensure you have ample capacity available."
Content_ID_TIPS_OTHER_00080,"It appears that the route of the\nGrand Titus from the port town of Lendor to\nthe continent of Lendersia has been reopened\nfollowing the defeat of Netherlord Nergel.\n\nHowever, to board the Grand Titus,\nyou'll need to obtain a special quest from\nthe traveling concierge in town.\n\nVisit the travel concierge in any town to\nreceive this special quest.\n\nTo unlock this quest, you must first complete the task\n'Concierge to accompany you on your journey',\nenabling you to utilize the concierge's services\nduring your travels.\n\nIf you haven't completed it yet,\nprioritize clearing this quest.\n\nFurthermore, with the route now restored,\nnew offerings will be introduced at various exchanges as\nyou progress through your adventures.\n\nIf you're curious, consider exploring them.\n\nNow, let's journey to the continent of Lendersia,\nwhere the hero princess awaits!"
Content_ID_TIPS_OTHER_00090,"Special movie unlocked!\n\nThank you for experiencing\n'The Sleeping Hero and the Guiding Allies.'\n\nWe've crafted a special cinematic treat to\nunveil the secrets of 'Ancient Dragon Lore' to\nall who've conquered the stage.\n\nYou can view this exclusive movie via\n'Watch Movie' in the Adventure Book menu.\n\nIn 'Ancient Dragon Lore', a captivating new saga unfurls,\nintroducing a mysterious dragon lineage.\n\nFor further details, kindly refer to the official website."
Content_ID_TIPS_PROMOTION_00010,"The distribution of\n'Sleeping Hero and Guiding Allies' has commenced!\n\nThis expansive downloadable content continues\nthe narrative of 'The Five Awakened Tribes.'\n\nSet amidst the uncharted terrain of the\nnew continent of Lendersia, this adventure unfolds with\nencounters with the Hero Princess and\nthe unveiling of new dungeons.\n\nAs your journey unfolds,\nexpect fresh lineups to emerge at exchange points,\npromising an abundance of new adventures.\n\nEmbark on this journey to unravel the mysteries of\nthe new continent alongside newfound companions!"
