Key,SourceString
SYSTXT_MONSTER_TIPS2_MONSTER_NO_15702,"He has the personality of bringing good luck to everything, \nHe is bound by countless rules, such as the order in which he puts on his shoes in the morning, \n and where he washes his shoes in the bath."
SYSTXT_MONSTER_TIPS2_MONSTER_NO_15705,"Even though he is part of the Great Demon King's Guard, he is under the command of the \nMasked Man.\nHe feels dissatisfied with his current position, but \n suppresses his emotions with an iron will."
SYSTXT_MONSTER_TIPS2_MONSTER_NO_16000,"Long ago, between the scales on its back, \nA nut dropped by a bird sprouted.\nSoon, it grew into a magnificent tree. \nIt is truly a mystery of nature!"
SYSTXT_MONSTER_TIPS2_MONSTER_NO_16001,"Back herbs are effective for beauty. \nIf you eat it every day without fail, \nit has an anti-aging effect, and\n is targeted by adventurers in the world."
SYSTXT_MONSTER_TIPS2_MONSTER_NO_16002,"The tree on his back burns, so \nEven though he uses flame attacks, \nhe can't stand being attacked.\nHe's such a selfish guy."
SYSTXT_MONSTER_TIPS2_MONSTER_NO_16100,"Some slime-like and some ghost-like \nAn unknown new face. \nIs there a secret under the hat?"
SYSTXT_MONSTER_TIPS2_MONSTER_NO_16102,"Why did \n fall to the dark side of black mold... There is a \n story of Hakkō that brings tears to the story."
SYSTXT_MONSTER_TIPS2_MONSTER_NO_16104,"They are confident in their own delicious taste.\nEspecially the compatibility with \nbasil and tomato coated with olive oil is \nexcellent."
SYSTXT_MONSTER_TIPS2_MONSTER_NO_16200,"Mimic intended to transform into a treasure chest, but \nWhat did I do wrong? It transformed into a chest of drawers. \nA new kind of monster was born here."
SYSTXT_MONSTER_TIPS2_MONSTER_NO_16201,"Originally, it had \na rather boring name, \nCannibal Chest, but in order to compete with \nPandora Box, it was renamed to something \ncooler."
SYSTXT_MONSTER_TIPS2_MONSTER_NO_16204,"I hear \nthat it's trick-or-treating, but no matter which option you choose, \nthey're ready to devour your opponent and \nare faced with two hellish choices."
SYSTXT_MONSTER_TIPS2_MONSTER_NO_16303,"Fujin Chiya has a \nsecret hobby that he is hiding. \nIt's about collecting belly buttons.\nIt seems that children's belly buttons are especially good."
SYSTXT_MONSTER_TIPS2_MONSTER_NO_16601,"Even though he is an executioner, he is not \n punishing criminals, but is a villainous person who \n only attacks people he doesn't like for selfish \n reasons."
SYSTXT_MONSTER_TIPS2_MONSTER_NO_16602,"He acts strong outside, but \nWhen he returns home, he is bullied by demons.\nHe is put in the way by his children.\nHe feels weak."
SYSTXT_MONSTER_TIPS2_MONSTER_NO_16700,"It's strange that \nwomen are forced to call themselves Mummy Man! \nIn the mummy world, there is a \n name change movement by mummy women."
SYSTXT_MONSTER_TIPS2_MONSTER_NO_16701,"The bandages worn by Mummy were made during the \nAncient Kingdom period. \nExcellent breathability and elasticity\nA product of forgotten technology."
SYSTXT_MONSTER_TIPS2_MONSTER_NO_BOSS_0014,"He is the number one of the Four Demon Generals and considers himself to be the brainiest one, but \nthe other three generals do not think of him that way at all."
SYSTXT_MONSTER_TIPS2_MONSTER_NO_BOSS_0025,"Twin brother to the guardian of the jungle. \nUnable to control his anger at the poachers ravaging the forest, his older brother \nbecame an avenger who hunted travelers."
SYSTXT_MONSTER_TIPS2_MONSTER_NO_BOSS_0026,"Twin brothers with the jungle hunter. \nHe was heartbroken by the poachers who were destroying the forest, so his younger brother \nbecame the guardian of the trees."
SYSTXT_MONSTER_TIPS2_MONSTER_NO_BOSS_0036,"The evil god of nothingness, the master of Fūma, is said to be the god of forgetfulness and despair. \nOne of the evil beings that attacked Astortia in the Age of Mythology."
SYSTXT_MONSTER_TIPS2_MONSTER_NO_BOSS_0065,"Ten Otsukijin is a being who has both Yin and \nYang Qi. \nAs a result, he looks like a woman, but \nis also a man."
SYSTXT_MONSTER_TIPS2_MONSTER_NO_BOSS_0076,"A kind older sister who cares about her younger sister Brenda. \nThe number one in the Demon King's army. \nThe owner of a plump bust."
SYSTXT_MONSTER_TIPS2_MONSTER_NO_BOSS_0077,"Amaenbou's little sister who loves her older sister Belinda. \nThe effects of Montserro hot springs will make your skin as smooth as silk."
SYSTXT_MONSTER_TIPS2_MONSTER_NO_BOSS_0149,"Worried and suffering, I despise beings who wonder as \nimperfect and inferior. \nThey cannot accept that this is what makes them human."
SYSTXT_MONSTER_TIPS2_MONSTER_NO_BOSS_0156,"It is a ruthless monster that \n even betrays its own friends, but \nZeldorad was attracted to its nature and became one of the \nFour Demon Lords."
SYSTXT_MONSTER_TIPS2_MONSTER_NO_BOSS_0172,"Created during the \n process of researching demonic miasma by the sage Eidos. \nTherefore, it has no will and \nonly follows Eidos' orders."
SYSTXT_MONSTER_TIPS2_MONSTER_NO_BOSS_0211,"I was \ncompeting with my cousin, the magic demon Bedlar, to see which one would destroy the Tenth Flower.\nHe was one step ahead, and \nI was feeling panicked inside."
SYSTXT_MONSTER_TIPS2_MONSTER_NO_BOSS_0218,"It seems that 5 heads were divided on whether or not to \n help their bad friend Diego, but by a slim margin of 3 to 2 they decided \n to help."
SYSTXT_MONSTER_TIPS2_MONSTER_NO_BOSS_0225,"The fear of the person who took your life is \nhard to wipe away, even if you call it an ally.\nThe memory of that fear distorts the real image and \nmakes the virtual image seem much more powerful."
SYSTXT_MONSTER_TIPS2_MONSTER_NO_BOSS_0342,"He lives with the sole purpose of \ncreating strong monsters by repeating experiments. \nI will choose any means for that purpose."
SYSTXT_MONSTER_TIPS2_MONSTER_NO_BOSS_0357,"When he was once a human, \nhe stood on the legendary "Otachidai" and\nevery night, he used to make everyone excited."
SYSTXT_MONSTER_TIPS2_MONSTER_NO_BOSS_0400,"It seems that Melsandi Village has also been attacked by other \nmonsters with giant faces and giant feet. \nWhat is the purpose of these monsters?"
SYSTXT_MONSTER_TIPS2_MONSTER_NO_BOSS_0410,"As Anlucia fell into despair, \nWhat she envisioned was the \nColossus of the Hero, which ironically weighed heavily on her heart."
SYSTXT_MONSTER_TIPS2_MONSTER_NO_BOSS_0415,"The Vortex of Creation in the false world is a transformed fragment of the \n Spiritual Core that \nMadesagora accidentally obtained. \nThat world was created from there."
SYSTXT_MONSTER_TIPS2_MONSTER_NO_BOSS_0420,"Even if your birth was a lie, \nthe last survivor should be the \ntrue being. \nI am the true hero!"
SYSTXT_MONSTER_TIPS2_MONSTER_NO_BOSS_0424,"In order to reassure Old Dime, \nTegram decided to become Princess Anlucia's royal guard. His determination was betrayed by the princess in question."
SYSTXT_MONSTER_TIPS2_MONSTER_NO_BOSS_0430,"It is said that Belmud, the demon master, mixed the \n appearances of the \n monsters he used to follow and chose it as his own \n monster form."
SYSTXT_MONSTER_TIPS2_MONSTER_NO_BOSS_0440,"My first encounter with the Great Demon King was when I saw \n's work in the demon world. \nIt is said that he was deeply moved by the Great Demon King's great wish for creation. \n"
SYSTXT_MONSTER_TIPS2_MONSTER_NO_BOSS_0450,"He shows that he has a bad temper, but he is hiding the fact that \nhe really wants to hear the sound of the dragon flute. \nShe has a cautious personality contrary to her appearance. \n"
SYSTXT_MONSTER_TIPS2_MONSTER_NO_BOSS_0451,"When I heard the sound of the dragon flute for the first time in a while, \nI couldn't help but come closer to you, but \nI was rushed into battle. \nHe has a cheerful personality. \n"
SYSTXT_MONSTER_TIPS2_MONSTER_NO_BOSS_0452,"It is the youngest of the three wyverns.\nThis is the first time I have heard the sound of a dragon flute.\nI don't think it's that bad. \nA gentle personality that emphasizes balance. \n"
SYSTXT_MONSTER_TIPS2_MONSTER_NO_BOSS_0460,"Actually, he is the grandson of the demon Zonggaron's \ncousin, but neither Zonggaron nor Galray himself \n know of such a connection."
SYSTXT_MONSTER_TIPS2_MONSTER_NO_BOSS_0470,"In the past, he used to often bake bread for Zankrone. \nBut all the bread I make \nfor some reason turns out to be extremely spicy."
SYSTXT_MONSTER_TIPS2_MONSTER_NO_BOSS_0490,"Guren's skin has a temperature that can melt rocks. \nSoaking up to your shoulders in molten rock \nRelieving the fatigue of battle, I look forward to \n a Makai-style bedrock bath every night."
SYSTXT_MONSTER_TIPS2_MONSTER_NO_BOSS_0491,"As part of the Demon King's army's bodyguards, they are often entrusted with the bodyguards of \n important people, but \n important people are generally stronger."
SYSTXT_MONSTER_TIPS2_MONSTER_NO_BOSS_0520,"Painting can \nexpress even the feelings of the heart. \nHis wildness makes him worthy of being called a \nbeast."
SYSTXT_MONSTER_TIPS2_MONSTER_NO_BOSS_0521,"A painting can be said to be a three-dimensional structure reproduced on a flat surface. \nObjects are actually cylinders, \ncones, and spheres."
SYSTXT_MONSTER_TIPS2_MONSTER_NO_BOSS_0522,"Fantasy and dreams are not reality, but they have the potential to exceed \n reality. \nWhen these invade the world, \na new reality is born."
SYSTXT_MONSTER_TIPS2_MONSTER_NO_BOSS_0525,"Once he obtained the Spiritual Core of Creation, \nthe Great Demon King painted all of Astortia with \na false world and \n intended to become the God of Creation."
SYSTXT_MONSTER_TIPS2_MONSTER_NO_PYR_0001,"Once upon a time, the Guardian of the Treasure placed a curse on the \ntreasure chest to protect the \nGolden Treasure. Even now, \ncurses poison grave robbers."
SYSTXT_MONSTER_TIPS2_MONSTER_NO_BOSS_0212,"It is said that it was once \nsummoned and served by a great summoner. \nWhenever he scratched his head in bed, he lied \nIt seemed like he was mainly twitching."
SYSTXT_MONSTER_TIPS2_MONSTER_NO_08806,"His name and appearance are exactly like a certain sage from the demon world, but he is just like someone else. \nIn terms of status and ability in the demon world, \nthis one is completely superior."
SYSTXT_MONSTER_TIPS2_MONSTER_NO_BOSS_0515,"It seems that the souls of \nthe followers of an evil religion have taken up residence in a building in the city where \nthose who worshiped a certain evil god lived \nand have begun to move."
SYSTXT_MONSTER_TIPS2_MONSTER_NO_BOSS_0462,"It is said that it was once \nsummoned and served by a great summoner. He is \na violent person, but \nhe seems to be surprisingly loyal to his master."
SYSTXT_MONSTER_TIPS2_MONSTER_NO_BOSS_0530,"In a far-off legendary era, \nAs the keeper of the undersea treasure vault, he defeated countless challengers and \ninstilled trauma in them."
SYSTXT_MONSTER_TIPS2_MONSTER_NO_BOSS_0465,"It was designed with \n super technology of Makai Science to wipe out humanity. \nIt is said that it has the ability to destroy the world three times \n if allowed to go out of control. \n"
SYSTXT_MONSTER_TIPS2_MONSTER_NO_BOSS_0821,"My daily routine is to shape the slime's \n beard with my proud twin swords. \nIf he fails, he won't be able to go out until his beard grows out."
SYSTXT_MONSTER_TIPS2_MONSTER_NO_08901,"Before he turned over to the Demon King, he was \n revered as the lord of exorcism and the \n exorcism of darkness and the saving of the world's crisis."
SYSTXT_MONSTER_TIPS2_MONSTER_NO_2018_XMAS_1,"My policy is to \n only fight those I consider to be strong. \nBut he doesn't come around very often, so I'm itching all year round."
SYSTXT_MONSTER_TIPS2_MONSTER_NO_BOSS_0436,"A selfish brat general who once stole a \n valuable harp, a treasure of the Monkey Kingdom, and \n strummed it according to his desires."
SYSTXT_MONSTER_TIPS2_MONSTER_NO_BOSS_0411,"Although he is not a hero, the blood of the \nGranzedora royal family that flows through him is said to be \nthe perfect material for making \nhero replicas."
SYSTXT_MONSTER_TIPS2_MONSTER_NO_13003,"He is good at seeing into people's hearts, and the \nplan to take advantage of the sadness of adults and invade Seredo with a false world was his idea."
SYSTXT_MONSTER_TIPS2_MONSTER_NO_BOSS_0264,"Pursuing something sweet\nKnowing the joy of sweet love\nHaving become a little more mature\nThe monster Pusugon is now awakening!"
SYSTXT_MONSTER_TIPS2_MONSTER_NO_14201,"The gargoyle's voice is \na ridiculously raspy voice. \nHe seems to be concerned about it too.\nSometimes he gargles with rainwater."
