Key,SourceString
SYSTXT_CAREER_STORY_DWF2_014,"{PC} defeated the \nUrubear Demon Soldier in the Ulubear Underground Ruins. \nHis father was worried about the identity of the phantom thief Poiclin.\nWhen Duston learned that it was his daughter Chili,\nHis junk was more important than his own life! I said \n and made her laugh. \nAt Chili's recommendation, she was able to receive the \nKey Emblem at Junk Castle."
SYSTXT_CAREER_STORY_DWF2_015,"When he returned to the junk castle in Gatara, the capital city of Gatara, \n{PC} but Duston had forgotten about the \n key emblem. \nHe was attentive, and when Potsukon \nfound a yellow key emblem from a pile of junk, {PC} was able to \ntake it safely."
SYSTXT_CAREER_STORY_DWF3_101,"Go north on the Chaldea Mountain Pass and cross the Gobble Desert.\nIt seems that something amazing has been discovered at the research institute of the Dolworm Kingdom."
SYSTXT_CAREER_STORY_DWF3_102,"Go north on the Chaldea Mountain Pass and cross the Gobble Desert.\nIt seems that something amazing has been discovered at the research institute of the Dolworm Kingdom."
SYSTXT_CAREER_STORY_DWF3_103,"Go north on the Chaldea Mountain Pass and cross the Gobble Desert.\nIt seems that something amazing has been discovered at the research institute of the Dolworm Kingdom."
SYSTXT_CAREER_STORY_DWF3_104,"Go north on the Chaldea Mountain Pass and cross the Gobble Desert.\nIt seems that something amazing has been discovered at the research institute of the Dolworm Kingdom."
SYSTXT_CAREER_STORY_DWF3_002,"When \n{PC} arrived at the Kingdom of Dolworm, he tried to enter the Crystal Palace, but \nwas unable to enter as he did not have the certificate of full-fledged status."
SYSTXT_CAREER_STORY_DWF3_003,"After arriving in the Dolworm Kingdom, \n{PC} heard at the Dolwurm Crystal Palace that \nthe Director of the Royal Research Institute would \nmake an important announcement soon. \n She was advised that {PC} also \n meet with the Director at the Crystal Palace."
SYSTXT_CAREER_STORY_DWF3_004,"After arriving in the Dolworm Kingdom, \n{PC} heard at the Dolwurm Crystal Palace that \nthe Director of the Royal Research Institute would \nmake an important announcement soon. \n She was advised that {PC} also \n meet with the Director at the Crystal Palace."
SYSTXT_CAREER_STORY_DWF3_005,"Dolwurm Crystal Palace The {PC} visited the \nDirector's Office of the Royal Research Institute and saw \nDirector Dura heading to the \nThrone Room where King Ullard was waiting."
SYSTXT_CAREER_STORY_DWF3_006,"When \n{PC} visited the throne room of the Dolwurm Crystal Palace, he saw an experiment conducted by Director Dura of the Royal Research Institute to turn \nMikaristone into Sunstone. \nWhen King Ulard announces that he will give a \nreward to those who collect the miasma stones, \n {PC} recognizes him as a \nservant of Lunana, who was present. Go to Calsadora Volcano in the east and get \nMagic Stone! was ordered."
SYSTXT_CAREER_STORY_DWF3_007,"When \n{PC} visited the throne room of the Dolwurm Crystal Palace, he saw Director Dura of the Royal Research Institute perform an experiment to turn \nMiracle Stone into Sun Stone. \nWhen King Ulard announces that he will give a \nreward to those who collect the miasma stones, \n {PC} recognizes him as a \nservant of Lunana, who was present. Go to Calsadora Volcano in the east and get \nMagic Stone! was ordered."
SYSTXT_CAREER_STORY_DWF3_008,"To Lunana, go east to Calsadora Volcano and get the \nMagical Stone! \nThe {PC} left the throne room and saw \nPrince Ramiza and his researcher named Chili \ntalking. \nPrince Ramiza compares himself to Director Dura.\nHe seems to be sinking into self-loathing."
SYSTXT_CAREER_STORY_DWF3_009,"To Lunana, go east to Calsadora Volcano and get the \nMagical Stone! \nThe {PC} left the throne room and saw \nPrince Ramiza and his researcher named Chili \ntalking. \nPrince Ramiza compares himself to Director Dura.\nHe seems to be sinking into self-loathing."
SYSTXT_CAREER_STORY_DWF3_010,"{PC} has arrived at Calsadora Volcano. \nAfter receiving the magic cloth to wrap the demon stone, \n{PC} heads deep into the \nvolcano to dig up the demon stone."
SYSTXT_CAREER_STORY_DWF3_011,"A \nMashouuo appeared in front of the {PC} as they headed deep into the \nCalsadora volcano to dig up the demon stone and attacked them. \n {PC} fought against Mashouuo, but \n lost."
SYSTXT_CAREER_STORY_DWF3_012,"When {PC} defeated Mashouuo, \nLunana and his friends appeared and started digging around. \nThey unearthed a huge demonic stone, but there was a seal affixed to it. \nShe tore off the seal and obtained the \nhuge demon stone. Lunana gave \n {PC} a small piece of the demon stone as a thank you. After giving it to her, she returned to Dolworm."
SYSTXT_CAREER_STORY_DWF3_013,"I returned to \nDolworm Kingdom to give the small piece of miasmastone I had obtained to \nthe members of the Royal Research Institute.{PC} is \nthe bard Fumiimi's twin born into the royal family\n. lf>I heard you singing a song you wrote about your sad fate."
SYSTXT_CAREER_STORY_DWF3_014,"{PC} gave a small piece of miasma stone to \nZibel in front of the Crystal Palace and received \na small thank you. \nThen her Lunanas also returned, and \nshe found a huge demonic stone. \n Impressed by its size, her director Dura immediately goes to the throne room of the Crystal Palace and says he will turn the collected demon stones into stones of the sun."
SYSTXT_CAREER_STORY_DWF3_015,"The giant miasma stone was \nsealing the soul of Tenma Quabarna. Director Dura learns that he was used by Quavarna and tells King Ulard that he is an abandoned prince. \nHowever, the king did not care about this and ordered his knights to subjugate \nKavallna, who was said to have headed for the \nBoronus Hole in the Boronus Lava Flow at the western end of the Dwachakka continent."
SYSTXT_CAREER_STORY_DWF3_016,"The giant miasma stone was \nsealing the soul of Tenma Quabarna. Director Dura learns that he was used by Quavarna and tells King Ulard that he is an abandoned prince. \nHowever, the king did not care about this and ordered his knights to subjugate \nKavallna, who was said to have headed for the \nBoronus Hole in the Boronus Lava Flow at the western end of the Dwachakka continent."
SYSTXT_CAREER_STORY_DWF3_017,"The giant miasma stone was \nsealing the soul of the Tenma Quabarna. Director Dura learns that he was used by Quavarna and tells King Ulard that he is an abandoned prince. \nHowever, the king did not care about this and ordered his knights to subjugate \nKavallna, who was said to have headed for the \nBoronus Hole in the Boronus Lava Flow at the western end of the Dwachakka continent."
SYSTXT_CAREER_STORY_DWF3_018,"The giant miasma stone was \nsealing the soul of Tenma Quabarna. Director Dura learns that he was used by Quavarna and tells King Ulard that he is an abandoned prince. \nHowever, the king did not care about this and ordered his knights to subjugate \nKavallna, who was said to have headed for the \nBoronus Hole in the Boronus Lava Flow at the western end of the Dwachakka continent."
SYSTXT_CAREER_STORY_DWF3_019,"The {PC} headed to the Pit of Boronus and witnessed \nthe spirit of the Tenma Quabarna take back \n his body. \n{PC} fought against \nQuavarna, whose seal was completely broken, but lost."
SYSTXT_CAREER_STORY_DWF3_020,"Defeated by {PC}, Tenma Quavarna \n delivered a final blow to {PC}. \nWhen Director Dura appeared and caught her, \nQuavarna cursed and disappeared. \nDirector Dura was angry at Prince Ramiza's late appearance \n and returned to Dolworm."
SYSTXT_CAREER_STORY_DWF3_021,"King Ulard, Prince Ramiza \n, and the king's real child Chiri combined their \n powers to stop the \n Sun Stone from running amok in the throne room of the Dolworm Crystal Palace. \nDirector Dura strongly blamed him for his own mistakes, but \neveryone recognized his ability and was forgiven. \n{PC} was awarded a gold key emblem in recognition of \nhis accomplishments in subjugating Quavarna."
SYSTXT_CAREER_STORY_ELF1_002,"{PC} lost his life to \n being burned by the flames of Nergel, the Hades, but was reborn as an \n elf student living in the village of Tskul, guided by \n a mysterious voice. \n{PC} seems to be taking on the \ngraduation exam called Wakaba's Attempt."
SYSTXT_CAREER_STORY_ELF1_003,"In the square of the learning garden, the \nFirst Trial of Wakaba's Trial The beginning of the Trial of Wisdom was announced. \nGo out from the west exit of the village of Tskul and follow the road to the west to the \n Shrine of Wisdom, which appears to be the exam venue. \nThe most senior students raced to be the first to leave the village, heading for the Shrine of Wisdom."
SYSTXT_CAREER_STORY_ELF1_004,"In the learning garden plaza, the \nFirst Trial of Wakaba's Trial The beginning of the Trial of Wisdom was announced. \nGo out from the west exit of the village of Tskul and follow the road to the west to the \n Shrine of Wisdom, which appears to be the exam venue. \nThe most senior students raced to be the first to leave the village, heading for the Shrine of Wisdom."
SYSTXT_CAREER_STORY_ELF1_005,"Upon arriving at the Shrine of Wisdom, the venue for the test of knowledge, {PC} answered \nMaster Toyohoro's mysterious question. \nThen Master Toyohoro told {PC} that \nhis test of knowledge was now over and ordered him to \n return to the learning garden in the village of Tskul and \n report to Master Izuyanoi."
SYSTXT_CAREER_STORY_ELF1_006,"After completing the test of knowledge and returning to the Garden of Learning, \n{PC} asked his teacher Izuyanoi to \nreturn to his room in the dormitory and rest \nuntil the other students returned. I was told to stay."
SYSTXT_CAREER_STORY_ELF1_007,"After completing the test of knowledge, \n{PC} was resting in his room when news arrived that \nthe successful candidates would be announced. It seems that the announcement of successful candidates will be held in \n the learning garden plaza."
SYSTXT_CAREER_STORY_ELF1_008,"Even though many students took on the challenge, only three people passed the test of knowledge: {PC}\nKyusuke Asanagi. \nThe {PCs} were given the \nLula Stone, proof of passing the test of knowledge.\nIn order to take the test of strength, he first went to \nthe hall of Himea, the shrine maiden of Tskul.< lf>I was asked to receive misogi."
SYSTXT_CAREER_STORY_ELF1_009,"{PC} underwent \nmisogi at the shrine maiden's mansion to take the second \ntest of strength. It seems that the exam venue, World Tree Hill, is located in \nEternal Forest, to the east of \nTsuskul Village from the southern exit. \nIt seems Asanagi and the others set off for \n the hill of the World Tree one step ahead of her."
SYSTXT_CAREER_STORY_ELF1_010,"{PC} underwent \nmisogi at the shrine maiden's mansion to take the second \ntest of strength. It seems that the exam venue, World Tree Hill, is located in \nEternal Forest, to the east of \nTsuskul Village from the southern exit. \nIt seems Asanagi and the others set off for \n the hill of the World Tree one step ahead of her."
SYSTXT_CAREER_STORY_ELF1_011,"A young leaf spirit appeared before \n{PC} who arrived at the hill of the World Tree, the place of trial. \nIt seems that if she can show her power to the young leaf spirit, she can pass the \ntest of power. \n{PC} challenged the young leaf spirit, but \nlosed the battle."
SYSTXT_CAREER_STORY_ELF1_012,"Just when I defeated the spirit of the young leaves, \nsuddenly a demonic miasma appeared, took away the life of my teacher, and \nenveloped the hill of the World Tree. \nIn front of the {PC}, who were in a desperate situation, \na dazzling light shined down and removed the demonic miasma. \nIn order to save the decaying World Tree, the young leaf spirit \n gave its life to the World Tree. Asanagi and his friends \n returned to the village of Tsuskuru in sadness."
SYSTXT_CAREER_STORY_ELF1_013,"The shrine maiden Himea said that the \ndazzling light that saved the {PC}s was the light of the awakening of the heroes.\nShe gave the {PCs} the proof of being full-fledged and commanded them \nto depart. She then told him that Himea should see through \n {PC}'s true identity and \n train and collect key emblems in other countries."
SYSTXT_CAREER_STORY_ELF1_015,"The shrine maiden Himea says that the \ndazzling light that saved {PC} and the others is the light of the awakening of the hero. \nTold to collect \nkey emblems in other countries in order to learn about her own mission, \n{PC} leaves the village of \nTskul in pursuit of the wider world. The spirit of young leaves was watching from a distance."
SYSTXT_CAREER_STORY_ELF2_101,"In the Windy City of Azuran, \nThere seems to be some trouble."
SYSTXT_CAREER_STORY_ELF2_102,"In the Windy City of Azlan, \nThere seems to be something wrong."
SYSTXT_CAREER_STORY_ELF2_103,"In the Windy City of Azran, \nThere seems to be something wrong."
SYSTXT_CAREER_STORY_ELF2_104,"In the Windy City of Azlan, \nThere seems to be something wrong."
SYSTXT_CAREER_STORY_ELF2_105,"In the Windy City of Azlan, \nThere seems to be something wrong."
SYSTXT_CAREER_STORY_ELF2_002,"{PC} met Taketora, the \nlord of the Windy City of Azran. Taketora \nlooked like he wanted to ask something, but he said that \nhe can't ask for help from someone who doesn't have \ncertainty."
SYSTXT_CAREER_STORY_ELF2_003,"When \n{PC} arrived at the Windy City of Azran, he was stopped by the traveling swordsman Gunza. According to Gunza's story, \nthe townspeople are blaming the wind for \nhis stagnation."
SYSTXT_CAREER_STORY_ELF2_004,"Recently, \nthe townspeople in the windy town of Azran have been expressing \nanxiety about the stagnant wind. \nIn order to save the town, the lord Taketora orders his daughter Fuura to become \nthe new wind rider, but \nFuura seems reluctant to join her. \nGo to Taketora and visit Fuura in her room.\nAsk her what's on her mind! I was asked."
SYSTXT_CAREER_STORY_ELF2_005,"I visited \nFura's room at the request of the lord Taketora {PC}. \nHowever, it seems that Fuura has gone out of town. \nAccording to Sonne, the helper, Fuura left \nAzuran and went north to \nCape Kazawai to visit her mother's grave."
SYSTXT_CAREER_STORY_ELF2_006,"At the request of the lord Taketora, I visited \nFura's room {PC}. \nHowever, it seems that Fuura has gone out of town. \nAccording to Sonne, the helper, Fuura left \nAzuran and went north to \nCape Kazawai to visit her mother's grave."
SYSTXT_CAREER_STORY_ELF2_007,"When we arrived at Cape Kazawai, \n Fuura was surrounded by monsters. \nThe Kamushikas that appeared fended off the monsters and saved Fuura. It seems that Fuura has opened up a little to \nKamshika and the others. \nFura decided to become a wind rider and returned to the windy town of Azuran."
SYSTXT_CAREER_STORY_ELF2_009,"When I went to Azuran, the town of wind, Fuura was on a journey to obtain two sacred tools called \nTaduna of the Wind and \nKokoromo of the Wind. \n{PC} asks Lord Taketora to follow \nFura and watch over him! \n was asked. Fuura says that he headed south of Azran to a mountainous checkpoint on the Inamino Highway."
SYSTXT_CAREER_STORY_ELF2_010,"When I went to Azuran, the town of wind, Fuura was on a journey to obtain two sacred tools called \nTaduna of the Wind and \nKokoromo of the Wind. \n{PC} asks Lord Taketora to follow \nFura and watch over him! \n was asked. Fuura says that he headed south of Azran to a mountainous checkpoint on the Inamino Highway."
SYSTXT_CAREER_STORY_ELF2_011,"When you arrive at the mountain checkpoint on the \nInamino Road, where the craftsman Nkara, who creates wind tethers, lives, \nFura with Kamushika and his friends appears and receives the wind tether from Nkara. \nIn order to obtain \nthe next divine tool-like Koromo, Fuura headed to \nSui's Tower, which towers over Suizen Wetland."
SYSTXT_CAREER_STORY_ELF2_012,"When you arrive at the mountain checkpoint on the \nInamino Highway, where the craftsman Nkara, who creates wind tethers, lives, \nFura with Kamushika and his friends appears and receives the wind tether from Nkara. \nIn order to obtain \nthe next divine tool-like Koromo, Fuura headed to \nSui's Tower, which towers over Suizen Wetland."
SYSTXT_CAREER_STORY_ELF2_013,"When you arrive at the mountain checkpoint on the \nInamino Highway, where the craftsman Nkara, who creates wind tethers, lives, \nFura with Kamushika and his friends appears and receives the wind tether from Nkara. \nIn order to obtain \nthe next divine tool-like Koromo, Fuura headed to \nSui's Tower, which towers over Suizen Wetland."
SYSTXT_CAREER_STORY_ELF2_014,"Another sacred tool: \n{PC} and Fuura arrive at the Sui Tower in the Suizen Wetland, where the Wind Koromo sleeps. \nHowever, at the top of the tower, a mysterious monster, \nPusugon, prevented them from obtaining the wind and \n{PC} lost the battle."
SYSTXT_CAREER_STORY_ELF2_015,"Arriving at \nSui's Tower, where one of the sacred tools, the Wind Koromo, sleeps, {PC} and \nFura defeated the \n monster Pusugon, who was preventing them from obtaining the Wind Koromo. \nHe obtained the Wind's Wind, and Fura hurriedly returned to \nAzuran, the Windy City, with Kamushika and the others."
SYSTXT_CAREER_STORY_ELF2_016,"Fura, the new wind rider, held a ceremony to send off the wind for the first time in six years. \nA new wind has begun to blow, and the windy city of Azran seems to have regained peace."
SYSTXT_CAREER_STORY_ELF2_017,"Fura, the new wind rider, held a ceremony to send off the wind for the first time in six years. \nA new wind has begun to blow, and the windy city of Azran seems to have regained peace. \n{PC} was recognized by the feudal lord Taketora as a hero who brought hope to \nthe town, and was given a \ngreen key emblem."
SYSTXT_CAREER_STORY_ELF3_101,"In the \n royal capital of Kamiharumui, which is located \n beyond the \n mountain barrier from the Inamino Road, the \n minister is looking for someone with a certificate of full-fledged status. It seems so."
SYSTXT_CAREER_STORY_ELF3_102,"In the \n royal capital of Kamiharumui, which is located \n beyond the \n mountain barrier from the Inamino Road, the \n minister is looking for someone with a certificate of full-fledged status. It seems so."
SYSTXT_CAREER_STORY_ELF3_103,"In the \n royal capital of Kamiharumui, which is located \n beyond the \n mountain barrier from the Inamino Road, the \n minister is looking for someone with a certificate of full-fledged status. It seems so."
SYSTXT_CAREER_STORY_ELF3_104,"In the \n royal capital of Kamiharumui, which is located \n beyond the \n mountain barrier from the Inamino Road, the \n minister is looking for someone with a certificate of full-fledged status. It seems so."
SYSTXT_CAREER_STORY_ELF3_002,"When \n{PC} arrived at the royal capital of Kamiharmui, he tried to enter the castle, but he could not \nenter unless the soldiers guarding him showed him that he was a full-fledged man! I was told \n."
SYSTXT_CAREER_STORY_ELF3_004,"It seems that King Nikoloi of the royal capital of Kamihalmy has been frequenting the former \nKamihalmy Castle, known as the \nAbandoned Castle, in order to find out what happened to his family 50 years ago. \n{PC} goes to the \nMinister of Kotor, who is concerned about the king's safety, to an abandoned castle north of the royal capital of Kamihalmy, \nin the depths of the dream forest, to check on the \nking. I want you to! I was asked."
SYSTXT_CAREER_STORY_ELF3_005,"It seems that King Nikoloi of the royal capital of Kamihalmy has been frequenting the former \nKamihalmy Castle, known as the \nAbandoned Castle, in order to find out what happened to his family 50 years ago. \n{PC} goes to the \nMinister of Kotor, who is concerned about the king's safety, to an abandoned castle north of the royal capital of Kamihalmy, \nin the depths of the dream forest, to check on the \nking. I want you to! I was asked."
SYSTXT_CAREER_STORY_ELF3_006,"It seems that King Nikoloi of the royal capital of Kamihalmy has been frequenting the former \nKamihalmy Castle, known as the \nAbandoned Castle, in order to find out what happened to his family 50 years ago. \n{PC} goes to the \nMinister of Kotor, who is concerned about the king's safety, to an abandoned castle north of the royal capital of Kamihalmy, \nin the depths of the dream forest, to check on the \nking. I want you to! I was asked."
SYSTXT_CAREER_STORY_ELF3_007,"At the request of the Minister of Kotor, {PC} followed King Nikoloi \n and arrived at an abandoned castle. {PC} saw a person who looked like \nKing Nikoloi walking alone towards \nthe palace. I made it."
SYSTXT_CAREER_STORY_ELF3_008,"At the request of the Minister of Kotor, I pursued King Nikoloi and arrived at the \nabandoned castle {PC}. \nThere, a frightening apparition appears in which the king's sister Rita kills her mother, \nas if it were a reenactment of her past. \nHis King Nikoloi collapses after seeing a vision. \nKyusuke, who was present, took over the king's body and told him to return to \nKamiharumui Castle."
SYSTXT_CAREER_STORY_ELF3_010,"King Nikoloi believed that \nthere was some important meaning behind his mother Agushna seeking the leaves of the Great Dark Tree on the verge of \ndeath. \nI ordered him to get some leaves. \nBefore going to the foot of the Great Dark Tree, \n {PC} made a promise with Kyusuke that he and Kyusuke would \n meet up in the village of Gakeppuchi."
SYSTXT_CAREER_STORY_ELF3_011,"King Nikoloi believed that \nthere was some significance behind his mother Agushna seeking the leaves of the Great Dark Tree on the verge of her death. \nI ordered him to get some leaves. \nBefore going to the foot of the Great Dark Tree, \n {PC} made a promise with Kyusuke that he and Kyusuke would \n meet up in the village of Gakeppuchi."
SYSTXT_CAREER_STORY_ELF3_012,"King Nikoloi believed that \nthere was some significance behind his mother Agushna seeking the leaves of the Great Dark Tree on the verge of her death. \nI ordered him to get some leaves. \nAt Gakeppuchi Village, he heard from Kyusuke that \nthe Great Dark Tree had \n a branch with only one leaf."
SYSTXT_CAREER_STORY_ELF3_013,"King Nikoloi believed that \nthere was some significance behind his mother Agushna seeking the leaves of the Great Dark Tree on the verge of her death. \nI ordered him to get some leaves. \nAt Gakeppuchi Village, he heard from Kyusuke that \nthe Great Dark Tree had \n a branch with only one leaf."
SYSTXT_CAREER_STORY_ELF3_014,"King Nikoloi believed that \nthere was some significance behind his mother Agushna seeking the leaves of the Great Dark Tree on the verge of \ndeath. \nI ordered him to get some leaves. \n{PC} reached the base of the Great Dark Tree, but his path was blocked by the guardians of the Great Dark Tree, and he lost the battle."
SYSTXT_CAREER_STORY_ELF3_015,"King Nikoloi ordered \n{PC} to obtain a \n leaf from the Great Dark Tree at the western end of the continent for his late mother Agushuna. \nThe {PC} arrived at the foot of the Great Dark Tree. \nHe ignored the guardians of the Great Dark Tree and \n successfully obtained the leaves of the Great Dark Tree."
SYSTXT_CAREER_STORY_ELF3_016,"After \nreceiving the leaves of the Great Dark Tree from {PC}, King Nikoloi headed for the throne room of the \nabandoned castle deep in the Dream Forest. \n {PC} is requested by his Minister of Kotor to \nfollow King Nikoloi to his \nthrone room in the palace of the abandoned castle to protect him! I was asked."
SYSTXT_CAREER_STORY_ELF3_017,"At the request of the Minister of Kotor, {PC} followed King Nikoloi to the \nAbandoned Castle. {PC} \nKing Nikoloi and Kyusuke headed for \nthe throne room of the abandoned castle. I saw it moving towards."
SYSTXT_CAREER_STORY_ELF3_018,"King Nikoloi's mother, Queen Agushuna, has been released from \n50 years of sealing. \nIn order to check the state of the sacred place protected by the royal family, \n {PC} and his girlfriend Queen Agushna and others decided to head for the \nroyal garden. \nThe royal garden seems to be located \naround the back of the abandoned castle, along the \nstone wall, from the old settlement area around the castle."
SYSTXT_CAREER_STORY_ELF3_019,"Using the power of the \ngolden ring held by King Nikoloi, \nentered the holy land, \nQueen Agushuna suddenly appeared in her true form and called herself \nAragne the Monster Insect. Aragne reveals that \n he has been pretending to be her queen for 50 years and has been targeting \n the sacred place, and \n attacks {PC}. \n{PC} has lost the battle."
SYSTXT_CAREER_STORY_ELF3_020,"After entering the sacred place, Queen Agushuna revealed her true form and called herself the monster Aragne. \n When {PC} defeats her Aragne, \nRita appears, still in her form 50 years ago. After Rita finished her role, \nwithout realizing that the old man in front of her was her younger brother, she disappeared \n wishing for her younger brother's happiness."
SYSTXT_CAREER_STORY_ELF3_021,"The monster Aragne was defeated by {PC}, and the power of the sacred land returned to the continent of Eltna. \n{PC} was hailed as a hero and received \na cherry blossom key emblem from \nKing Nikoloi. King Nikoloi swore that he would fulfill his \n role as the protector of the sacred place, inheriting the wishes of \nhis older sister Rita."
SYSTXT_CAREER_STORY_PUK1_002,"{PC} lost his life when \nwas burned by the flames of Nergel, the Hades, but was reborn as a \nPukripo young man living in the village of Pukret, guided by a \nmysterious voice. \n{PC} in this village \nis said to be the best actor in the village, even\n going so far as to stop someone's heart in order to make them laugh."
