Key,SourceString
SYSTXT_CAREER_STORY_WED3_019,"At the request of \nCeria, a former princess who was saved from the waters of eternity, I followed Basagrande.\n{PC}. Celia and her queen Diore's eternal song weakened her power.\nShe fought against Basagrande and defeated her beautifully. \nCaslan flees, and the {PCs} and the \nreturn to the castle."
SYSTXT_CAREER_STORY_WED3_020,"When \n{PC} headed to the Queen's Hall in Verinard Castle, he saw Queen Diore blaming \nPrince Odis, but \nThe two reconciled after Celia's words. \n{PC} was given a silver key emblem by the \nqueen at the advice of the prince. \nThe prince strongly declared in front of everyone that he would become a good king."
SYSTXT_CAREER_STORY_WED3_021,"As \n{PC} was about to leave Verinard Castle, he saw Queen Diore sing \na song of blessing once again, and \nholy protection was bestowed on the water below the castle."
SYSTXT_CAREER_STORY_OGR1_002,"{PC} lost his life when he was burned by the flames of Nergel, the Hades, but was reborn as a young ogre living in Rangao Village, guided by a \nmysterious voice. \nIt seems that the owner of this ogre body died in \n an ice cave in Rhonda. \nLet's go and thank Mayu, the daughter of the village king, for bringing her from the ice cave to the village."
SYSTXT_CAREER_STORY_OGR1_003,"When {PC} visited Mayu, Mayu pointed out that \nthe Lula Stone that he always wore was missing. \nIf you go to the place where {PC} fell, you may find \nLula Stone and \nabout yourself. Leave the village and \ngo west along the road. Pass through Ronda's ice cave \nsouthwest and go to Cape Ronda."
SYSTXT_CAREER_STORY_OGR1_004,"When {PC} visited Mayu, Mayu pointed out that \nthe Lula Stone that he always wore was missing. \nIf you go to the place where {PC} fell, you may find \nLula Stone and \nabout yourself. Leave the village and \ngo west along the road. Pass through Ronda's ice cave \nsouthwest and go to Cape Ronda."
SYSTXT_CAREER_STORY_OGR1_005,"When {PC} visited Mayu, Mayu pointed out that \nthe Lula Stone that he always wore was missing. \nIf you go to the place where {PC} fell, you may find \nLula Stone and \nabout yourself. Leave the village and \ngo west along the road. Pass through Ronda's ice cave \nsouthwest and go to Cape Ronda."
SYSTXT_CAREER_STORY_OGR1_006,"When \n{PC} obtained the Rula Stone at Cape Rhonda, he and \nthe ogre girl Jenya appeared and witnessed \nGiganf looking unusual. \nZiganf had received his power from the ancient demon \nZongalon in order to carry out divine punishment against his Arold. \nLet's go report to the village king of Rangao Village!"
SYSTXT_CAREER_STORY_OGR1_007,"{PC} tried to report to \nthe village king about the Giganf he saw at Cape Rhonda, but was chased out of the \nvillage king's room by \nJenya, who came in a hurry. \nPlease say hello to Mayu's childhood friend, Arold, who went from the village king to the village's fighting arena! I was asked."
SYSTXT_CAREER_STORY_OGR1_008,"The reason Giganf held a grudge against Arold was because \nArold deliberately lost to Giganf in a martial arts tournament two years ago. \nGeganf's anger reached its peak as Arold did as he was without fighting back. \nGiganf's appearance turned into a monster, he kidnapped Mayu, and he disappeared to Zonggaron. \nLet's hurry to Cape Ronda."
SYSTXT_CAREER_STORY_OGR1_009,"\nZiganf, who kidnapped Mayu and came to Cape Ronda to settle the score with Arold, was completely controlled by the \npowerful thoughts of the demon Zonggaron. \nThe {PC} rushed to Cape Rhonda.\nHe lost his mind and fought Giganf, but \nlosed."
SYSTXT_CAREER_STORY_OGR1_010,"At Cape Rhonda, {PC} defeated \nthe insane Giganf. \nHowever, at the call of the evil demon Zonggaron, \nGiganf used all his strength and broke \nZonggaron's barrier. \nIn a desperate moment, a white light enveloped the world. \nZongalon was resealed and his Giganf returned to \n its original form. Let him go to the village king's house."
SYSTXT_CAREER_STORY_OGR1_011,"The {PC} visited the village king's house, received \nGiganf's blessing, and \n saw off Arold and Mayu as they departed. \nAfter hearing the story of someone who was brought back to life by the village king, \n{PC} was given the proof of being a full-fledged person. \nIt seems that if he travels around the world and collects medals called key emblems, he can \n meet someone who knows his true self."
SYSTXT_CAREER_STORY_OGR1_013,"After hearing the story of a person who was brought back to life by the village king, \n{PC} received the proof of being a full-fledged person. \nIt seems that if he travels around the world and collects medals called key emblems, he can \n meet someone who knows his true self. \nFollowing Arold and his friends, Jenya also left \nRangao Village."
SYSTXT_CAREER_STORY_OGR2_101,"Gren Castle seems to be recruiting \nsoldiers with the certificate of full-fledged service."
SYSTXT_CAREER_STORY_OGR2_102,"Gren Castle seems to be recruiting \nsoldiers with the certificate of full-fledged service."
SYSTXT_CAREER_STORY_OGR2_103,"Gren Castle seems to be recruiting \nsoldiers with the certificate of full-fledged service."
SYSTXT_CAREER_STORY_OGR2_104,"Gren Castle seems to be recruiting \nsoldiers with the certificate of full-fledged service."
SYSTXT_CAREER_STORY_OGR2_105,"Gren Castle seems to be recruiting \nsoldiers with the certificate of full-fledged service."
SYSTXT_CAREER_STORY_OGR2_106,"Gren Castle seems to be recruiting \nsoldiers with the certificate of full-fledged service."
SYSTXT_CAREER_STORY_OGR2_002,"After arriving at Glen Castle, {PC} tried to \nenter the throne room, but was stopped \n by the soldier Nidolf. Nidolf says that \nKing Bagdo only meets \nthose who have the credentials of being a full-fledged soldier and have volunteered to become \nsoldiers."
SYSTXT_CAREER_STORY_OGR2_003,"When \n{PC} arrived at Glen Castle, he was stopped by Gordo, a resident of the town. According to Gord's story, \nthis country is gathering brave men to fight alongside him in anticipation of his future with Gartland."
SYSTXT_CAREER_STORY_OGR2_203,"When \n{PC} arrived at Glen Castle, he was stopped by Gordo, a resident of the town. According to Gord's story, \nthis country is gathering brave men to fight alongside him in anticipation of his future with Gartland."
SYSTXT_CAREER_STORY_OGR2_004,"{PC} met \nKing Bagdo in the throne room of Glen Castle, but he was judged to be a scourge to the country, and he and Sage Eidos were thrown into \nprison. \nHe was soon released by Soldier Commander Zidan, but \nI want King Bagdo back! At \n's request, he stayed at an inn and decided to \n visit Eidos."
SYSTXT_CAREER_STORY_OGR2_005,"The {PC} headed to the inn to meet \nSage Eidos and retrieve \nLemur's Holy Grail, which is needed to rid King Bagdo of \nthe demon! \n was asked. The Holy Grail of Lemuru is said to be located in the depths of Bekong Valley in the northern part of the western Guren territory."
SYSTXT_CAREER_STORY_OGR2_006,"The {PC} headed to the inn to meet \nSage Eidos and retrieve \nLemur's Holy Grail, which is needed to rid King Bagdo of \nthe demon! \n was asked. The Holy Grail of Lemuru is said to be located in the depths of Bekong Valley in the northern part of the western Guren territory."
SYSTXT_CAREER_STORY_OGR2_007,"The {PC} heads to the inn to meet \nSage Eidos and retrieve \nLemur's Holy Grail, which is needed to rid King Bagdo of \nthe demon! \n was asked. The Holy Grail of Lemuru is said to be located in the depths of Bekong Valley in the northern part of the western Guren territory."
SYSTXT_CAREER_STORY_OGR2_008,"At the request of Eidos, {PC} came to the \ncave of \nBekong Valley in search of the Holy Grail of Lemuru, which is needed to rid \nof the evil miasma that possessed \nKing Bagdo. \nThen a monster named Oren, the swordsman, appears and attacks {PC}. \n{PC} fought against the demon swordsman Oren, but \n lost."
SYSTXT_CAREER_STORY_OGR2_009,"At the request of Eidos, {PC} came to the \ncave of \nBekong Valley in search of the Holy Grail of Lemuru, which is needed to rid \nof the evil miasma that possessed \nKing Bagdo. \nThen a monster named Oren, the swordsman, appears and attacks {PC}. \n{PC} defeated the demon swordsman Oren and obtained \nRemuru's Holy Grail."
SYSTXT_CAREER_STORY_OGR2_011,"According to Eidos, \nKing Bagdo will be cured if he drinks the drops of \nGlorith he received from Lemuru's Holy Grail. \nTo do so, he must go from the south of Guren territory to the \nsoutheast of the Gelt Strait and \nto Lake Clouds in the Landon Mountains."
SYSTXT_CAREER_STORY_OGR2_012,"According to Eidos, \nKing Bagdo will be cured if he drinks the drops of \nGlorith he received from Lemuru's Holy Grail. \nTo do so, he must go from the south of Guren territory to the \nsoutheast of the Gelt Strait and \nto Lake Clouds in the Landon Mountains."
SYSTXT_CAREER_STORY_OGR2_013,"According to Eidos, \nKing Bagdo will be cured if he drinks the drops of \nGlorith he received from Lemuru's Holy Grail. \nTo do so, he must go from the south of Guren territory to the \nsoutheast of the Gelt Strait and \nto Lake Clouds in the Landon Mountains."
SYSTXT_CAREER_STORY_OGR2_014,"According to Eidos, \nKing Bagdo will be cured if he drinks the drops of \nGlorith he received from Lemuru's Holy Grail. \nTo do so, he must go from the south of Guren territory to the \nsoutheast of the Gelt Strait and \nto Lake Clouds in the Landon Mountains."
SYSTXT_CAREER_STORY_OGR2_015,"I came to \nKumjo Lake in the Landon Mountains in search of Gloris Drops. \nThen, the water dragon Gilgish appears and attacks {PC}. \n{PC} fought \n against the water dragon Gilgish, but lost."
SYSTXT_CAREER_STORY_OGR2_016,"{PC} and Eidos came to Lake Clouds in the \nRandon Mountains in search of\ngloris drops. \nThe {PC} who defeated the water dragon Gilgish used \nLemur's Holy Grail to receive \nthe drops of Gloris. After drinking this, he returns to Glen Castle to rid himself of \nthe evil spirit from King Bagdo."
SYSTXT_CAREER_STORY_OGR2_017,"{PC} delivered the Drop of Gloris to \nGren Castle, and King Bagdo was freed from the miasma and returned to his senses. \nThe cause is the \nnecklace given to him by Gartland Castle, and Minister Chiguri says that he has already been disposed of by the \nhands of the Wise Marine. \n{PC} received the \nBlack Key Emblem in recognition of his efforts to save the country."
SYSTXT_CAREER_STORY_OGR3_101,"There are rumors that \nstrong people are missing at \nGartland Castle, which is located beyond \nZama Pass beyond Landonfoot."
SYSTXT_CAREER_STORY_OGR3_102,"There are rumors that \nstrong people are missing at \nGartland Castle, which is located beyond \nZama Pass beyond Landonfoot."
SYSTXT_CAREER_STORY_OGR3_103,"It seems that \nstrong people are rumored to be missing at \nGartland Castle, which is located beyond \nZama Pass beyond Landonfoot."
SYSTXT_CAREER_STORY_OGR3_104,"There are rumors that \nstrong people are missing at \nGartland Castle, which is located beyond \nZama Pass beyond Landonfoot."
SYSTXT_CAREER_STORY_OGR3_105,"There are rumors that \nstrong people are missing at \nGartland Castle, which is located beyond \nZama Pass beyond Landonfoot."
SYSTXT_CAREER_STORY_OGR3_003,"When \n{PC} arrived at Gartland Castle, the man who bumped into him had his \n wallet pickpocketed, but \na wise Marine who was passing by took it back."
SYSTXT_CAREER_STORY_OGR3_004,"When \n{PC} arrived at Gartland Castle, the man who bumped into him had his \n wallet pickpocketed, but \na wise Marine who was passing by took it back."
SYSTXT_CAREER_STORY_OGR3_005,"When \n{PC} visited the throne room of Gartland Castle, he saw \nArold having an audience with \nKing Glossner. According to the two of them, there are incidents in \nGertland where strong people suddenly disappear \n. \nArold left after being asked by King Glossner to \nsearch for the missing person."
SYSTXT_CAREER_STORY_OGR3_006,"{PC} was stopped by \nArold and Maille in Gartland Castle and \nasked for their cooperation in the problem of strong people disappearing. Arold and the others seem to be searching from \nthe Zama Beacon Tower in the north."
SYSTXT_CAREER_STORY_OGR3_008,"When \n{PC} went out to the castle town from Gartland Castle, he saw the traveling entertainer Puge entertaining the townspeople with his \nmagic tricks. \nLet's head to the Zama beacon stand in the north, which Arold and Mayu said they would use as a base for their search."
SYSTXT_CAREER_STORY_OGR3_009,"When \n{PC} went out to the castle town from Gartland Castle, he saw the traveling entertainer Puge entertaining the townspeople with his \nmagic tricks. \nLet's head to the Zama beacon stand in the north, which Arold and Mayu said they would use as a base for their search."
SYSTXT_CAREER_STORY_OGR3_010,"{PC} visited the Zama Fireplace in the north, but \nArold was not there. \nAccording to Maille, he said that Aroldo disappeared in a black haze. \nMaille must go and \nreport this to her King Glossner! She said that and she left the Zama Burning Stand."
SYSTXT_CAREER_STORY_OGR3_011,"{PC} visited the \nthrone room of Gartland Castle. \nGizac, one of the missing convoy, returned, and the woman in the white veil found \nthemselves in an abandoned house in the Gilzad region.< lf>I reported that I was captured at the remains of a pirate hideout. \nSoldier Spindle headed for the secret passageway in the abandoned house, but Mailu said he would go too, so lend him \npower! I was asked."
SYSTXT_CAREER_STORY_OGR3_012,"{PC} visited the \nthrone room of Gartland Castle. One of the missing transporters, \n Gizak, returned, and the woman in the white veil took them \nto an abandoned house in the Gilzad region.< lf>I reported that I was captured at the remains of a pirate hideout. \nSoldier Spindle headed for the secret passageway in the abandoned house, but Mailu said he would go too, so lend him \npower! I was asked."
SYSTXT_CAREER_STORY_OGR3_013,"{PC} visited the \nthrone room of Gartland Castle. One of the missing transporters, \n Gizak, returned, and the woman in the white veil took them \nto an abandoned house in the Gilzad region.< lf>I reported that I was captured at the remains of a pirate hideout. \nSoldier Spindle headed for the secret passageway in the abandoned house, but Mailu said he would go too, so lend him \npower! I was asked."
SYSTXT_CAREER_STORY_OGR3_014,"Under the ruins of a pirate hideout in the Gilzad region, \n{PC} found \na woman in a white veil. The woman who gained the power of the miasma stone transformed into \nthe demon Juliante and attacked \n {PC}. \n{PC} fought \nthe demon Juliente, but she lost."
SYSTXT_CAREER_STORY_OGR3_015,"\n{PC} defeated the demon Juliante in the basement of the pirate hideout in the Gilzad region. Captain Spindle picked up the \nmalestone necklace that had fallen and returned to the castle to \nreport it to King Glossner. \nMaille frees the captives, but \nArold is nowhere to be found, and she learns that \nonly the convoy was captured by Juliente."
SYSTXT_CAREER_STORY_OGR3_018,"In the throne room of Gartland Castle, \nSoldier Captain Spindle reported to King Grosner that he had \ndefeated the demon Juliente, and showed him \nthe necklace of miasma stone. \nThe king is surprised by the necklace that was supposed to have been disposed of by the wise Marine. The sage Marine revealed the monster's true identity, captured the soldier commander and the king, and left him for the \nancient Orseko arena in the Orseko Highlands."
SYSTXT_CAREER_STORY_OGR3_019,"In the throne room of Gartland Castle, \nSoldier Captain Spindle reported to King Grosner that he had \ndefeated the demon Juliente, and showed him \na necklace of miasma stone. \nThe king is surprised by the necklace that was supposed to have been disposed of by the wise Marine. The sage Marine revealed the monster's true identity, captured the soldier commander and the king, and left him for the \nancient Orseko arena in the Orseko Highlands."
SYSTXT_CAREER_STORY_OGR3_020,"When {PC} \narrived at the ancient Orseko Arena, they heard \nbattle shouts and breathing sounds coming from the arena's stage. \nIt seems that the sorcerer Marine is training the fierce warriors he has captured by \nfighting them together."
SYSTXT_CAREER_STORY_OGR3_021,"The sorcerer Marine appeared before \n{PC} as he stepped onto the stage of the ancient Orseco arena. The Marine realizes that it was {PC} who \ndefeated the demon Juliente.She \ncalls out Arold and Giganf. \nShe and Mayu appeared there and challenged the Marines, but she lost."
SYSTXT_CAREER_STORY_OGR3_022,"{PC} defeated \nSorcerer Marine on the Orseco Arena stage. When \nthe traveling entertainer Puge saw this, he reported it to his girlfriend, \nand disappeared without saying anything. \nArold and Giganf, her King Grosner, \ncome to your senses, thank {PC}, and \ncome to Gartland Castle! With that, he returned to \nthe castle."
SYSTXT_CAREER_STORY_OGR3_023,"The {PC} headed to Gartland Castle.\nHe was shown to the throne room as a hero.\nKing Glossner gave him a red key emblem for his \ndefeating the sorcerer Marine.\n I was given it."
SYSTXT_CAREER_STORY_DWF1_002,"{PC} lost his life when he was burned by the flames of Nergel, the Hades, but was reborn as a young dwarf living in the town of Agrani, guided by a \nmysterious voice. \n {PC} He is \n in the church in the upper town of Agrani on behalf of Master Hotzi, please \n talk to Lunana! I was asked."
SYSTXT_CAREER_STORY_DWF1_003,"Lunana planned to become the savior of Agrani and leave her mark on \nhistory. \n {PC} asks Lunana to \nvisit Broggen, the wise man of the Achronian mines.\nHe tells her that she is allowed to dig in areas where mining is prohibited.\nHe gives her a gift. Yo! \n was commanded. If he succeeds in doing so, he will receive \nLula Stone."
SYSTXT_CAREER_STORY_DWF1_004,"Lunana planned to become the savior of Agrani and leave her mark on \nhistory. \n {PC} asks Lunana to \nvisit Broggen, the wise man of the Achronian mines.\nHe tells her that she is allowed to dig in areas where mining is prohibited.\nHe gives her a gift. Yo! \n was commanded. If he succeeds in doing so, he will receive \nLula Stone."
SYSTXT_CAREER_STORY_DWF1_005,"When they went to the Acronian Mines, \n{PC} and the others were attacked by a demonic mist, but they escaped with the advice of \nWise Broggen. \nThen, after listening to {PC}'s story, \nBroggen learns that his girlfriend, Lunana, is planning to dig into the forbidden land, \nThe Commandment Land.\nSo that she doesn't make a mistake. In order to convince him, \nHe went to the church in the upper town of Agrani."
SYSTXT_CAREER_STORY_DWF1_006,"I went to persuade Lunana. I followed Sage Broggen \n to the church in Agrani, but \n she did not respond to my persuasion and left. \nThe wise man Broggen worries about this, and \n {PC} is asked to patrol the Warden Land. \nReceives her Lula Stone as a reward. \nOnce she was ready, she was told to come to \nHotzi's house in the lower town of Agrani."
SYSTXT_CAREER_STORY_DWF1_007,"When I went to Master Hotzi's house, I was told by the \nsage Broggen that the Acronia mine had been \n dangerous even before the \ncollapse because of a demonic miasma. . \nBroggen told the {PC} to come to \nthe Keeper's Room in the Achronian Mines, which leads to the \nLand of the Commandments, and \nhe left with Master Hotzi."
SYSTXT_CAREER_STORY_DWF1_008,"When you go to the guardian's room that leads to the Land of Commandments, you will find that \nLunana has forcibly headed to the Land of Commandments with her servants. \n In order to stop her Lunanas, {PC} hastened to the \n Commandment Land, which is located beyond the \n guarded door."
SYSTXT_CAREER_STORY_DWF1_009,"When I arrived at the Land of Commandments, \nLunana and the others were already digging there. \nThen, guided by their greedy hearts, \na monster named Maamon, a great vengeful spirit, revived and attacked \n{PC}. \n {PC} welcomed her Maamon, but \n lost."
SYSTXT_CAREER_STORY_DWF1_010,"The great vengeful spirit Maamon, which \nappeared because of Lunana and the others who ravaged the Commandment Land, was defeated by {PC} and became furious and became gigantic. \nHowever, due to the white light that fell upon him, \nMaamon disappeared and the mine returned to peace. \n {PC} was asked to come to \nMaster Hotzi's house in the lower town of Agrani to \ntalk to the wise man Broggen."
SYSTXT_CAREER_STORY_DWF1_011,"When {PC} returned from the Land of the Commandments, \nthe sage Broggen taught him that \nhe was a special being who had been brought back to life. \nHe then tells {PC} that Broggen must \n travel to other countries and collect \n key emblems that are proof of his ability in order to receive the proof of being a full-fledged person and fulfill his mission. <lf >He set out on a journey in pursuit of the light of the awakening of the hero."
SYSTXT_CAREER_STORY_DWF2_101,"It seems that \nphantom thieves have been appearing in Gakuto Gatara recently."
SYSTXT_CAREER_STORY_DWF2_102,"It seems that \nphantom thieves have been appearing in Gakuto Gatara recently."
SYSTXT_CAREER_STORY_DWF2_103,"It seems that \nphantom thieves have been appearing in Gakuto Gatara recently."
SYSTXT_CAREER_STORY_DWF2_104,"It seems that \nphantom thieves have been appearing in Gakuto Gatara recently."
SYSTXT_CAREER_STORY_DWF2_105,"It seems that \nphantom thieves have been appearing in Gakuto Gatara recently."
SYSTXT_CAREER_STORY_DWF2_106,"It seems that \nphantom thieves have been appearing in Gakuto Gatara recently."
SYSTXT_CAREER_STORY_DWF2_002,"When \n{PC} arrived at the mountain capital of Gatara, he tried to enter the \nJunk Castle that the townspeople were rumored to have, but \ncouldn't enter because it was locked. \nShe probably shouldn't come yet."
SYSTXT_CAREER_STORY_DWF2_003,"When \n{PC} arrived at the city of Gatara, he saw two men \ncomplaining that \nthey couldn't get the key emblem. I heard it. \nAccording to their story, a person named \nDuston, who lives in Garakuta Castle, has \nhis key emblem..."
SYSTXT_CAREER_STORY_DWF2_004,"When \n{PC} visited Garakuta Castle in the mountain city of Gatara, he saw a person calling himself \n the phantom thief Poiclin stealing Duston's treasure and \nrunning away. \nPotsucon came out of the junk castle and chased after \n."
SYSTXT_CAREER_STORY_DWF2_005,"When you meet Duston, the owner of the junk castle, and ask him about the \nkey emblem, \n{PC} somehow ends up being appointed as his assistant, \nPotsukon No. 2. \n {PC} wants Duston to take back the \ngreen tablet that was stolen by the \nphantom thief Poiclin! I was asked. \nIt is said that Poiclin disappeared to the northeast."
SYSTXT_CAREER_STORY_DWF2_006,"When you meet Duston, the owner of the junk castle, and ask him about the \nkey emblem, \n{PC} somehow ends up being appointed as his assistant, \nPotsukon No. 2. \n {PC} wants Duston to take back the \ngreen tablet that was stolen by the \nphantom thief Poiclin! I was asked. \nIt is said that Poiclin disappeared to the northeast."
SYSTXT_CAREER_STORY_DWF2_007,"When you meet Duston, the owner of the junk castle, and ask him about the \nkey emblem, \n{PC} somehow ends up being appointed as his assistant, \nPotsukon No. 2. \n {PC} wants Duston to take back the \ngreen tablet that was stolen by the \nphantom thief Poiclin! I was asked. \nIt is said that Poiclin disappeared to the northeast."
SYSTXT_CAREER_STORY_DWF2_008,"Following the phantom thief Poiclin, {PC} entered \nChaldea Mountain Pass. {PC} saw \nthe phantom thief Poiclin entering \nChaldea Cave. \n {PC} will \n be ahead of Duston, who appears there, and make him say, \n follow him! I was told."
SYSTXT_CAREER_STORY_DWF2_009,"Following the phantom thief Poiclin, {PC} entered \nChaldea Mountain Pass. {PC} saw \nthe phantom thief Poiclin entering \nChaldea Cave. \n {PC} will \n be ahead of Duston, who appears there, and make him say, \n follow him! I was told."
SYSTXT_CAREER_STORY_DWF2_010,"{PC} was deep inside Chaldea Cave when he saw the \nphantom thief Poicrin throw away the \ngreen tablet into the magma. \nPoicrin revealed the true nature of the green stone tablet as the key to \nopening the door to the underground ruins of the ancient Ulbear Empire, and then left. \nDuston managed to obtain the discarded green tablet \nand returned to the junk castle."
SYSTXT_CAREER_STORY_DWF2_011,"When \n{PC} visited Garakuta Castle in the mountain city of Gatara, he heard from Potsukon that \nDuston had a daughter named \nChili, who was not related by blood. \nDuston says he should come to the \nUluvea Underground Ruins located northwest of the Gatara Fields! He left a message for \n{PC}."
SYSTXT_CAREER_STORY_DWF2_112,"The phantom thief Poiclin appeared in front of \n{PC} as he entered the underground ruins of Ulvea. {PC} wants Poiclin to stop \nDuston, who went deeper into the ruins with the green tablet! I was asked. \nIt is said that a mysterious ancient weapon lies behind the door at the back of the Ulvea underground ruins."
SYSTXT_CAREER_STORY_DWF2_012,"The phantom thief Poicrin appeared in front of \n{PC} as he entered the Ulvea underground ruins. {PC} wants Poiclin to stop \nDuston, who went deeper into the ruins with the green tablet! I was asked. \nIt is said that a mysterious ancient weapon lies behind the door at the back of the Ulvea underground ruins."
SYSTXT_CAREER_STORY_DWF2_013,"\n{PC} went to the depths of the Ulvea underground ruins and tried to stop \n Duston from opening the door, but he was unable to do so in time and \n Duston went to the other side of the door. \nAs I followed him, he was attacked by Urubear demon soldiers. \n {PC} and the others were attacked. \n {PC} fought \n against the Ulbear demon soldiers, but lost."
