Key,SourceString
SYSTXT_CAREER_STORY_PUK1_003,"The {PC} went to Pilippo's house and was told that \nhe is \nthe legendary Pukuripo, who has won the \nentertainment grand prix many times in the village of Pukret. \nAlso, when I went outside the village, I learned that I had dropped the Lula Stone somewhere. \nLooks like she has to report to the village chief that she lost the Lula Stone."
SYSTXT_CAREER_STORY_PUK1_004,"{PC} went to the village chief's house and reported to the \nvillage chief that he had lost the \nLula Stone, but since the Lula Stone is \nan important item for those who travel the world, \nhe needs to find it. love! I was told. \nGoing west along the highway, he goes to the sage's hideout at the end of the \nbridge in the Popora region and \nlooks like he should ask sage Eidos."
SYSTXT_CAREER_STORY_PUK1_005,"{PC} went to the village chief's house and reported to the \nvillage chief that he had lost the \nLula Stone, but since the Lula Stone is \nan important item for those who travel the world, \nhe must look for it. love! I was told. \nGoing west along the highway, he goes to the sage's hideout at the end of the \nbridge in the Popora region and \nlooks like he should ask sage Eidos."
SYSTXT_CAREER_STORY_PUK1_006,"{PC} went to the village chief's house and reported to the \nvillage chief that he had lost the \nLula Stone, but since the Lula Stone is \nan important item for those who travel the world, \nhe must look for it. love! I was told. \nGoing west along the highway, he goes to the sage's hideout at the end of the \nbridge in the Popora region and \nlooks like he should ask sage Eidos."
SYSTXT_CAREER_STORY_PUK1_007,"In the sage's hideout, sage Eidos was trying to seal off something like \nblack mist. \n {PC} asked Eidos where the Lula Stone was \nand was told that someone who stole the Lula Stone was \nlurking in the darkness. . \nPuddin in the \nvillage of Pucret seems to know where the Lulastone is."
SYSTXT_CAREER_STORY_PUK1_008,"{PC} asked Pudin at Philippo's house where the \nLula Stone was, and was told that it was likely to be found in the \nBare Valley to the north. \nOnce upon a time, {PC} was killed by a serpent of filth.\nHis parents were killed and he could no longer smile.\nHe went to the Valley of filth for Puddin. It looks like he was killed by a giant snake. \n"
SYSTXT_CAREER_STORY_PUK1_009,"{PC} asked Pudin at Philippo's house where the \nLula Stone was, and was told that it was probably in the \nBare Valley to the north. \nOnce upon a time, {PC} was killed by a serpent of filth.\nHis parents were killed and he could no longer smile.\nHe went to the Valley of filth for Puddin. It looks like he was killed by a giant snake. \n"
SYSTXT_CAREER_STORY_PUK1_010,"When \n{PC} arrived at the serpent's lair in the valley of obscurity, the obscene serpent appeared before him. \nIt attacked me. \n {PC} fought against the Yamiwarashi, but \n lost."
SYSTXT_CAREER_STORY_PUK1_011,"\n{PC} arrived at the serpent's lair in the Vile Valley and defeated the Yamiwarashi. \nWhen the evil serpent was about to attack {PC}, a white light hit \nthe serpent and it returned to its den. \nThe light showed him that it was \nTiltskin who stole {PC}'s \nLulastone from him."
SYSTXT_CAREER_STORY_PUK1_012,"At the sage's hideout, \n {PC} heard from the sage Eidos about the person who \n was brought back to life, and \n {PC} recovered \n his Lulastone that had been \n taken away by Tiltskin. It seems that Pudin returned to \nPukret village ahead of others."
SYSTXT_CAREER_STORY_PUK1_013,"{PC} went to the house of the Pukkrei village chief and \n received the certificate of full-fledged status from the \n village chief as a thank you for driving away the evil serpent. \nHe raised his hands in each country and was told by the \n village chief to collect the \n medal called the Key Emblem and bring smiles to the world. \nPuddin also regained his smile thanks to his {PC} efforts."
SYSTXT_CAREER_STORY_PUK1_015,"\n{PC} was about to leave the village of Pukret when \nPuddin and Pirippo came to see him off. \nIn order to bring laughter and excitement to more people, \n {PC} and Puddin departed."
SYSTXT_CAREER_STORY_PUK2_101,"It appears that a \nspecial event will be held at the circus in the town of Orfea."
SYSTXT_CAREER_STORY_PUK2_102,"It appears that a \nspecial event will be held at the circus in the town of Orfea."
SYSTXT_CAREER_STORY_PUK2_103,"It appears that a \nspecial event will be held at the circus in the town of Orfea."
SYSTXT_CAREER_STORY_PUK2_104,"It appears that a \nspecial event will be held at the circus in the town of Orfea."
SYSTXT_CAREER_STORY_PUK2_002,"When \n{PC} arrived at the town of Orfea, he tried to enter the \ncircus tent in the center of the town, but \nstands at the entrance from Fulppo. \nI can't enter! That's what I was told."
SYSTXT_CAREER_STORY_PUK2_003,"When \n{PC} arrived at the town of Orphea, he was stopped by Harpoppo, a resident of the town. According to Harpoppo, \nthe town's famous Nab-Nub circus group will be holding a \nspecial performance."
SYSTXT_CAREER_STORY_PUK2_004,"{PC} went to the circus tent and saw \nCaptain Nablett's trick of making all the children in Orphea disappear. \nThe children will disappear from \nthe town of Orphea for today.Left behind \nmysterious words, \nCaptain Nablett disappeared."
SYSTXT_CAREER_STORY_PUK2_005,"{PC} met \nPuddin, a boy from another town who was taken in by a police officer, in the backstage of a circus tent. \nPuddin complained that \nCaptain Nablett, who made him a member, was not a bad person, but\nPuddin was kidnapped by Captain Nablett who suddenly appeared."
SYSTXT_CAREER_STORY_PUK2_006,"Behind the dressing room of the tent, {PC} tells \nHakaru, a member of the circus, that he came to town in search of the \nkey emblem, but \n is the one who has the key emblem. >It turned out to be Commander Nablett. \nThe place called Silver Hill that the leader is likely to go to is \nto the west of the Orfea region to the south.\nIt seems that his place in the Wrinkle region is further south."
SYSTXT_CAREER_STORY_PUK2_007,"Behind the dressing room of the tent, {PC} told \nHakaru, a member of the \ncircus, that he came to town in search of the \nkey emblem, but the one with the key emblem was\n >It turned out to be Commander Nablett. \nThe place called Silver Hill that the leader is likely to go to is \nto the west of the Orfea region to the south.\nIt seems that his place in the Wrinkle region is further south."
SYSTXT_CAREER_STORY_PUK2_008,"Behind the dressing room of the tent, {PC} tells \nHakaru, a member of the circus, that he came to town in search of the \nkey emblem, but the one who has the key emblem is <lf >It turned out to be Commander Nablett. \nThe place called Silver Hill that the leader is likely to go to is \nto the west of the Orfea region to the south.\nIt seems that his place in the Wrinkle region is further south."
SYSTXT_CAREER_STORY_PUK2_009,"{PC} went to Silver Hill and met \nCaptain Nablett, who was trapping children in a mysterious door. \nThe leader, without seeing the {PC}, figured out \n's race and said that the mysterious door \n would not open now, and next time he would \n meet him in Orphea! He said \n and left the silver hill. \n"
SYSTXT_CAREER_STORY_PUK2_011,"When {PC} returned to the town of Orphea, \nsuddenly a monster calling itself the devil Zaygus appeared. \nZygas said that 15 years ago, he had made a promise with a person named Alwe to give him the lives of his children. Captain Nabret appeared and told him that he had kidnapped the children, and he provoked Zaygas and lured him to \nFosteil Square in the Muruel Forest in the west."
SYSTXT_CAREER_STORY_PUK2_012,"When {PC} returned to the town of Orfea, \nsuddenly a monster calling itself the devil Zaygus appeared. \nZygas said that 15 years ago, he had made a promise with a person named Alwe to give him the lives of his children. Captain Nabret appeared and told him that he had kidnapped the children, and he provoked Zaygas and lured him to \nFosteil Square in the Muruel Forest in the west."
SYSTXT_CAREER_STORY_PUK2_013,"When {PC} returned to the town of Orfea, \nsuddenly a monster calling itself the devil Zaigas appeared. \nZygas said that 15 years ago, he had made a promise with a person named Alwe to give him the lives of his children. Captain Nabret appeared and told him that he had kidnapped the children, and he provoked Zaygas and lured him to \nFosteil Square in the Muruel Forest in the west."
SYSTXT_CAREER_STORY_PUK2_014,"In front of the {PC} who \narrived at Fosteil Square in Muruel Forest, \nCaptain Nablet and the demon Zygus were fighting \n. \nThanks to the statue of Fostail, they can't use their \npower as they wish. They fight against the demon Zaygus, but \n{PC} loses."
SYSTXT_CAREER_STORY_PUK2_015,"\n{PC} defeated the demon Zaigas at Fostel Square in Muruel Forest. \nFifteen years ago, Captain Nabret heard \nhis sister Alwe's prophecy, and in the fifteenth year, \nhe said that if he asked for help from the travelers who would come to the Silver Hill, he would be able to defeat \nZygas. He said he knew. \nCaptain Nablett headed to \nSilver Hill to free his children."
SYSTXT_CAREER_STORY_PUK2_016,"A mysterious door opened on the Silver Hill.\nThe {PC} watched as the children were freed.\n{PC} watched as Captain Nabret's younger sister \nArwe was attacked by the demon Zaigas for 15 years.<lf >We learn that he made a \n contract with Zygas to protect the children. I would like to receive a \nthank you from Captain Nablett, so please come to the \ncircus tent in the town of Orphea! I was asked."
SYSTXT_CAREER_STORY_PUK2_017,"Captain Navret tried to leave town as \napologies for kidnapping the children, but \nhe heard the voices of the children telling him not to stop, so he decided to \ncontinue with the NavNab Circus. {PC} was given a \nwhite key emblem by the \nleader along with his acrobatic cake."
SYSTXT_CAREER_STORY_PUK3_101,"From the west of the Orphea region, beyond the \nwindmill hill, \nto the west of the Megistris territory, in the \ncity of Megistris, \nsearch for a \nstrong adventurer with the proof of being a full-fledged person. It seems like it is."
SYSTXT_CAREER_STORY_PUK3_102,"From the west of the Orphea region, beyond the \nwindmill hill, \nto the west of the Megistris territory, in the \ncity of Megistris, look for \na strong adventurer who has the proof of being a full-fledged person. It seems like it is."
SYSTXT_CAREER_STORY_PUK3_103,"From the west of the Orphea region, beyond the \nwindmill hill, \nto the west of the Megistris territory, in the \ncity of Megistris, \nsearch for a \nstrong adventurer who has the proof of being a full-fledged person. It seems like it is."
SYSTXT_CAREER_STORY_PUK3_104,"From the west of the Orphea region, beyond the \nwindmill hill, \nto the west of the Megistris territory, in the \ncity of Megistris, look for \na strong adventurer who has the proof of being a full-fledged person. It seems like it is."
SYSTXT_CAREER_STORY_PUK3_105,"From the west of the Orphea region, beyond the \nwindmill hill, \nto the west of the Megistris territory, in the \ncity of Megistris, \nlook for a \nstrong adventurer who has the proof of being a full-fledged person. It seems like it is."
SYSTXT_CAREER_STORY_PUK3_002,"When \n{PC} arrived at Megistris Castle, he tried to enter the castle, but \nthe gatekeeper, Hoppa, said that anyone who did not have the proof of being a full-fledged person would not be allowed to enter! I was stopped. \n\n"
SYSTXT_CAREER_STORY_PUK3_003,"When \n{PC} arrived at Megistris Castle, he saw \nForster, known as the hero, entering the castle. \nFrom a conversation between Foster and his soldiers, \nhe learned that his King Poopoppan of Megistris Castle was \nsick."
SYSTXT_CAREER_STORY_PUK3_004,"When \n{PC} arrived at Megistris Castle, he saw \nForster, known as a hero, entering the castle. \nFrom a conversation between Foster and his soldiers, \nhe learned that his King Poopoppan of Megistris Castle was \nsick."
SYSTXT_CAREER_STORY_PUK3_005,"{PC} joins the \n subjugation squad from King Poupoppan in the \n throne room of Megistris Castle, and if you defeat the monster in the \n ceremony room of the Sparkling Windmill Tower, you will be given a \n key emblem. ! I was told. \nKing Poopoppan seems to be trying to protect the country from the evil miasma by \n performing a ritual in exchange for his own body in the ritual hall in the tower."
SYSTXT_CAREER_STORY_PUK3_006,"{PC} joins the \n subjugation team from King Poupoppan in the \n throne room of Megistris Castle, and if you defeat the monster in the \n ritual room of the Sparkling Windmill Tower, you will be given a \n key emblem. ! I was told. \nKing Poopoppan seems to be trying to protect the country from the evil miasma by \n performing a ritual in exchange for his own body in the ritual hall in the tower."
SYSTXT_CAREER_STORY_PUK3_007,"{PC} joins the \n subjugation squad from King Poupoppan in the \n throne room of Megistris Castle, and if you defeat the monster in the \n ritual room of the Sparkling Windmill Tower, you will be given a \n key emblem. ! I was told. \nKing Poopoppan seems to be trying to protect the country from the evil miasma by \n performing a ritual in exchange for his own body in the ritual hall in the tower."
SYSTXT_CAREER_STORY_PUK3_008,"As part of the subjugation team, \n{PC} headed to the Sparkling Windmill Tower and heard that the members of the \n subjugation team were rumoring that \nPrince Ragasu should perform the ceremony instead of King Poopoppan. heard."
SYSTXT_CAREER_STORY_PUK3_009,"As part of the subjugation team, \n{PC} headed to the Sparkling Windmill Tower and heard that the members of the \n subjugation team were rumoring that \nPrince Ragasu should perform the ceremony instead of King Poopoppan. heard."
SYSTXT_CAREER_STORY_PUK3_010,"\n{PC} and the subjugation team arrived during the ceremony at the Sparkling Windmill Tower, but \nthere was no monster there. \nSuddenly, \nsoldiers Thanato and Hypnos, who were in the subjugation squad and directly under the king's aide Id, turned into monsters and annihilated the subjugation squad. \nDemon Soldier Thanato \n{PC} lost the battle against the Demon Soldier Hypnos."
SYSTXT_CAREER_STORY_PUK3_011,"\n{PC} arrived during the ceremony at the Sparkling Windmill Tower and defeated the \n demon soldiers Thanato and Hypnos, who revealed their true nature. \nIt is said that on the orders of the king's close aide Id, \nthe two stained the ritual hall with the blood of the subjugation team. \nReturn to the throne room of Megistris Castle.\nLet's report to King Poopoppan."
SYSTXT_CAREER_STORY_PUK3_013,"{PC} went to the \nthrone room of Megistris Castle and reported to \nKing Poupoppan that soldiers under \nId's direct command had killed the subjugation team. \nKing Poopoppan did not believe the report.\nThe king's wrath enraged the {PC}, who \nwas chased out of the throne room."
SYSTXT_CAREER_STORY_PUK3_015,"{PC} will ask \nFostail in the city of Megistris to lend us \npower to save this country! I was asked. \nIn order to save the country, he needs \nAlwe's notebook, which can grant any wish. \nThere seems to be a clue hidden in the ruins of Queen Alwe's villa in the \nsoutheast of the South Linkle region west of the Orfea region."
SYSTXT_CAREER_STORY_PUK3_016,"{PC} will ask \nFostail in the city of Megistris to lend us \npower to save this country! I was asked. \nIn order to save the country, he needs \nAlwe's notebook, which can grant any wish. \nThere seems to be a clue hidden in the ruins of Queen Alwe's villa in the \nsoutheast of the South Linkle region west of the Orfea region."
SYSTXT_CAREER_STORY_PUK3_017,"{PC} will ask \nFostail in the city of Megistris to lend us \npower to save this country! I was asked. \nShe can make any wish come true in Alwe's notebook.\nLooking for clues, she arrives at the ruins of Queen Alwe's villa.{PC} sees a vision of the queen and enters a \nmysterious door. I saw a sight."
SYSTXT_CAREER_STORY_PUK3_018,"{PC} saw a scene from the past at the ruins of Queen Alwe's villa, where \nthe queen promised to give \nAlwe's notebook to her son, Prince Laguas. \nWe find out that the owner of the notebook is her Prince Laguas.\nWe return from Fostale to her Megistris castle.\nLet's borrow the power of his notebook from Prince Laguas! I was told."
SYSTXT_CAREER_STORY_PUK3_019,"{PC} found out in Prince Ragasu's room that \nFostail's true identity was a prince who changed \n form with the power of the notebook. \nId appeared on the scene, revealed the monster's true identity, and told him that if the life of a member of the royal family was \nsacrificed during a ritual stained with blood, the entire continent would be cursed.\nDisappeared. It's gone. During the ceremony at the Sparkling Great Windmill Tower, you must stop the king who is heading toward \n."
SYSTXT_CAREER_STORY_PUK3_020,"\n{PC} and Prince Laguas arrive during the ceremony at the Sparkling Windmill Tower. \nDuring a ritual stained with blood, he \nkills King Poopoppan and attempts to place a curse on the entire continent.\nHe engages in a battle with the demon strategist Id, but \n {PC} loses. It happened."
SYSTXT_CAREER_STORY_PUK3_021,"{PC} defeated the demon tactician Id. \nPrince Laguas wrote a wish in his notebook.\nThe continent was saved. The prince tried to save the life of King Poopoppan in exchange for his own life.\nWith his last wish, the prince tried to save the life of King Poopoppan, but he foresaw it.\nAt the request of Queen Alwe, he The notebook disappeared and the prince's life was saved. The prince thanked his father and mother and told them that he would return to Castle Megistris."
SYSTXT_CAREER_STORY_PUK3_022,"\n{PC} headed to the throne room of Castle Megistris and was given a \npurple key emblem by Prince Laguas. \nPrince Laguas has renewed his determination to protect \nthe country as a superior."
SYSTXT_CAREER_STORY_ZZZ1_001,"In the car of the Earth's Ark, I met an old man who called himself \n the Wandering Sage Hollow. \nHallow discovers that {PC} is \nthe people of Ethene.\nIn order to release the sealed Rendersia.\nHe first receives the key emblem, which is proof of his power. lf>Collect them! he said and left."
SYSTXT_CAREER_STORY_ZZZ1_002,"I was reunited with the wandering sage Hollow inside the Ark of the Earth. \nHallow will check the number of \nkey emblems that {PC} has obtained.\nOnce he has obtained 5 key emblems, he will defeat \nNergel the Dark Lord and save the sealed \nRendersia. I can entrust you with this mission! He said \n and left."
SYSTXT_CAREER_STORY_ZZZ1_003,"In the car of the Earth's Ark, {PC} \n suddenly had a dream of being attacked by Nergel. \nAccording to the guy I happened to be riding with, \nhe said the situation was more serious and \ndangerous than I expected. Enamel \nHe should collect 5 key emblems as soon as possible! he said and left. \nI have {Key_Em} key emblems."
SYSTXT_CAREER_STORY_ZZZ1_005,"Finally obtained \nthe five key emblems, {PC} meets Hollow inside the car of the \nEarth Ark.\nTo free the sealed Rendersia, \nNergel. I have to defeat it! I was told. \nHe said that there was an entrance to the underworld where Nergel was located, so he decided to go to the top of the Landon Mountains."
SYSTXT_CAREER_STORY_ZZZ1_006,"Finally obtained \nthe five key emblems, {PC} meets Hollow inside the car of the \nEarth Ark.\nTo free the sealed Rendersia, \nNergel. I have to defeat it! I was told. \nHe said that there was an entrance to the underworld where Nergel was located, so he decided to go to the top of the Landon Mountains."
SYSTXT_CAREER_STORY_ZZZ1_007,"Finally obtained \nthe five key emblems, {PC} meets Hollow inside the car of the \nEarth Ark.\nTo free the sealed Rendersia, \nNergel. I have to defeat it! I was told. \nHe said that there was an entrance to the underworld where Nergel was located, so he decided to go to the top of the Landon Mountains."
SYSTXT_CAREER_STORY_ZZZ1_008,"Finally obtained \nthe five key emblems, {PC} meets Hollow inside the car of the \nEarth Ark.\nTo free the sealed Rendersia, \nNergel. I have to defeat it! I was told. \nHe said that there was an entrance to the underworld where Nergel was located, so he decided to go to the top of the Landon Mountains."
SYSTXT_CAREER_STORY_ZZZ1_009,"Finally obtained \nthe five key emblems, {PC} meets Hollow inside the car of the \nEarth Ark.\nTo free the sealed Rendersia, \nNergel. I have to defeat it! I was told. \nHe said that there was an entrance to the underworld where Nergel was located, so he decided to go to the top of the Landon Mountains."
SYSTXT_CAREER_STORY_ZZZ2_001,"Nergel's Castle The bridge of light created by \nenamel to enter the heart of Hades was blocked by \nthe demon and collapsed. \nIn order to break through the demonic miasma enveloping Hades' heart, \nhe must borrow the power of a \nmagician who can create a ship of destruction. It seems that the magician of Hajafune lives in the castle town of \nGren Castle."
SYSTXT_CAREER_STORY_ZZZ2_002,"I visited \nFlukka, a descendant of the Hajafune user who lives in Glen Castle Town, but it seems that the Hajafune technique was lost \na long time ago. \nThe prophecy of Hollow's companion meant that she would use her Ethene's \ntime-traveling ability to \nresurrect the lost art! It seems that he intends to send \n the soul of {PC} back to the village of Etene in order to return him to human form."
SYSTXT_CAREER_STORY_ZZZ2_003,"With the guidance of Abba's ghost and the turtle's protection, \n regained his human body {PC}. \nAt the Temple of Light, I met the soul of another {PC}, the original owner of the alien body.\nWhen I returned to Glen Castle, I used the Hajafune technique to revive \n500 years ago. I decided to go to the world. \nIf you ride the Ark of the Earth in the form of the people of Ethene, \nit seems that you can travel to the lost era of the evil ships. \n"
SYSTXT_CAREER_STORY_ZZZ3_001,"{PC} borrowed the power of the Earth Ark and came to the world \n500 years ago in order to \nresurrect the lost art of Hajafune."
SYSTXT_CAREER_STORY_ZZZ3_002,"{PC} came to the world 500 years ago to revive the lost art of Hajafune, and \n witnessed a great disaster called \nReidametes. Raydames is said to be traveling around the world and burning down everything on earth. \nIt seems that many people have gathered at Glen Castle since he escaped from Raydames."
SYSTXT_CAREER_STORY_ZZZ3_003,"{PC} came to the world of \n500 years ago to revive the lost art of Hajafune, and \n witnessed a great disaster called \nReidametes. Raydames is said to be traveling around the world and burning down everything on earth. \nIt seems that many people have gathered at Glen Castle since he escaped from Raydames."
SYSTXT_CAREER_STORY_ZZZ3_004,"It seems that the evil boat master Bernhard who was looking for \nchallenged Leidametes and was consumed by the flames\nhas already died. \nHajafune's son, Herge, visited his leader, \nTheodore, and declared that he would inherit his father's will, but the people laughed at it. \nHerge seemed to have let his anger boil over as he returned to \n his room on the first floor of the castle."
SYSTXT_CAREER_STORY_ZZZ3_005,"It seems that the evil boat master Bernhard who was looking for \nchallenged Reidametes and was consumed by the flames\nhas already died. \nHajafune's son, Herge, visited his leader, \nTheodore, and declared that he would inherit his father's will, but the people laughed at it. \nHerge seemed to have let his anger boil over as he returned to \n his room on the first floor of the castle."
SYSTXT_CAREER_STORY_ZZZ3_006,"For the sake of the Hajafuneshi's pride, Herju departed to undergo the \n succession ceremony. \n {PC} is worried about his safety and wants his servant Kai to help him save Herju! \n was asked. It is said that Herju left Glen Castle and headed to a village in the northeast to meet \nYakul, one of the four magicians."
SYSTXT_CAREER_STORY_ZZZ3_007,"For the sake of the Hajafuneshi's pride, Herju departed to undergo the \n succession ceremony. \n {PC} is worried about his safety and wants his servant Kai to help him save Herju! \n was asked. It is said that Herju left Glen Castle and headed to a village in the northeast to meet \nYakul, one of the four magicians."
SYSTXT_CAREER_STORY_ZZZ3_008,"{PC} followed Herju and arrived at the village where \nYakul, the Four Magician lived. \nHe asks Herju to perform a succession ceremony. \nYakuru challenges him to bring water, but \nHerju doesn't listen. \nAsrai, the watchman, asked {PC} \nWhy don't he go back to Glen Castle and \nbring some water instead of Herju? said."
SYSTXT_CAREER_STORY_ZZZ3_009,"Ask Herju to perform a succession ceremony. \nYakul challenged Herju to bring water, but \nHerju would not listen. \n {PC} returned to \nGren Castle on Herju's behalf, where he received a \npot of water to give to Yakul."
SYSTXT_CAREER_STORY_ZZZ3_010,"After \nreceiving a pot filled with water from {PC}, the Four Magician Yakuru performed the succession ceremony for \nHerju. \nWhen Yakul told him that the next Four Magician was at the bridge in the Gerd Strait in the south, he departed for the \n Strait without saying a word of thanks. \n {PC} wants him to watch over \n Herju from Yakuru! I was asked."
SYSTXT_CAREER_STORY_ZZZ3_011,"After \nreceiving a pot filled with water from {PC}, the Four Magician Yakuru performed the succession ceremony for \nHerju. \nWhen Yakul told him that the next Four Magician was at the bridge in the Gerd Strait in the south, he departed for the \n Strait without saying a word of thanks. \n {PC} wants him to watch over \n Herju from Yakuru! I was asked."
